topic,title,text,cluster,id_hash,vector
Rechtswissenschaften,Interkulturelle Kommunikation im internationalen Business,"Diese Bachelorarbeit untersucht die Bedeutung und Herausforderungen der interkulturellen Kommunikation im internationalen Business. Durch eine Kombination aus Literaturrecherche und Fallstudien werden die kulturellen Unterschiede und deren Einfluss auf die Geschäftskommunikation analysiert. Es wird gezeigt, dass interkulturelle Kompetenzen entscheidend für den Geschäftserfolg in internationalen Märkten sind. Die Arbeit schließt mit Empfehlungen für Unternehmen, wie sie ihre interkulturellen Kommunikationsstrategien verbessern und interkulturelle Trainingsprogramme für ihre Mitarbeiter entwickeln können.",5,7a66cc562eadf2a928a72315a5a45812d710e14cf014db2e2a05dddce31c0256,"[0.3392293611794958, 0.022448403729705177, 0.02053161687015566, -0.009471928328070705, -0.061736390175599676, -0.02167321042161725, -0.13917882916833293, -0.05483799901134205, -0.010529697122812735, -0.06878026787986317, 0.13281559699496034, 0.01123562525197298, -0.027404145956866823, -0.027818951633405836, -0.1333658386618804, 0.06490903795802538, 0.032839655568734256, -0.00560884494845546, -0.02289352373000666, -0.11218509959972096, -0.022773392357640098, -0.006366042874033463, 0.030841065082840742, -0.04075515721420077, -0.1522718005584392]"
Politikwissenschaft,Die Rolle von Social Media in politischen Bewegungen,"Diese Arbeit untersucht die Rolle von Social Media in politischen Bewegungen und deren Einfluss auf die politische Partizipation und Meinungsbildung. Durch eine Kombination aus Literaturrecherche und Fallstudien werden verschiedene Beispiele politischer Bewegungen analysiert, die Social Media erfolgreich genutzt haben. Es wird gezeigt, dass Social Media Plattformen wie Twitter, Facebook und Instagram entscheidend für die Mobilisierung, Organisation und Kommunikation politischer Bewegungen sind. Abschließend werden die Chancen und Risiken der Nutzung von Social Media in der politischen Kommunikation diskutiert und Empfehlungen für den verantwortungsvollen Einsatz gegeben.",3,5fa5a09c6433eb26a88ecd4e86ab741342e204faec8718b06e332ed73e96da49,"[0.36795690312547463, 0.5049828369155648, -0.012596575533858189, 0.603614202092573, 0.009296098761390358, 0.09504331565720152, 0.02148776726523419, 0.023432329049640425, -0.09707498423037349, -0.0281099058240403, -0.07449477280166594, 0.05613267301246898, 0.03449633559040786, 0.037002132616660674, 0.048638323483572506, 0.03408339361473564, -0.05293340513955051, 0.03176609478715286, -0.07351837740117304, -0.058971397536628695, -0.03888574631182533, 0.008935345687521306, -0.002131422374248872, -0.009915714520678149, -0.011905221253794177]"
Politikwissenschaft,Populismus in der modernen Politik: Ursachen und Auswirkungen,"Diese Bachelorarbeit untersucht die Ursachen und Auswirkungen des Populismus in der modernen Politik. Durch eine Kombination aus Literaturrecherche und Fallstudien werden die Merkmale populistischer Bewegungen und deren Einfluss auf das politische System analysiert. Es wird gezeigt, dass Populismus oft als Reaktion auf soziale Ungleichheit und politische Unzufriedenheit entsteht und zu Polarisierung und Instabilität führen kann. Abschließend werden Strategien zur Bekämpfung des Populismus und zur Förderung einer inklusiven und stabilen politischen Kultur diskutiert.",2,0dedbe9538d1b46782fda0732490d0ca56aee453db672b981c899b573a11ac16,"[0.3373453241469797, 0.06516826987170664, 0.09436803602420757, 0.01021808814980553, 0.04415754799015181, 0.01041576518671598, 0.08078210561436047, -0.030008603987620782, 0.01730862743968329, -0.03486399302213199, -0.03086089897134761, 0.008926225259967892, 0.025937744018325076, -0.030279979429687694, 0.07436037671785739, 0.01250771285283821, 0.0009782586460517465, -0.024055665921574147, 0.030394437227097653, 0.006241460057782381, -0.0408013127213254, 0.011547352549638634, -0.06497917406535575, -0.006002564107794388, -0.004095544120460548]"
Politikwissenschaft,Internationale Zusammenarbeit bei globalen Gesundheitskrisen,"Diese Arbeit untersucht die Rolle der internationalen Zusammenarbeit bei der Bewältigung globaler Gesundheitskrisen. Durch eine Kombination aus Literaturrecherche und Fallstudien werden verschiedene Beispiele internationaler Kooperationen, darunter die Bekämpfung von Pandemien und die Verbesserung der globalen Gesundheitsinfrastruktur, analysiert. Es wird gezeigt, dass internationale Zusammenarbeit entscheidend für die e ektive Bewältigung globaler Gesundheitskrisen ist. Abschließend werden Empfehlungen für die Verbesserung der internationalen Gesundheitszusammenarbeit und die Stärkung globaler Gesundheitsorganisationen gegeben.",2,fdb8528fa84202a03fbf7243e96208628939298388250377a0f51178745baec7,"[0.26205237964860667, 0.053519885088218505, 0.03634983257067499, -0.03525692080635274, 0.042756567151790874, -0.025625137923003385, -0.008141291695742764, -0.11545315871330904, -0.0385497260648718, -0.061728556081601244, 0.027941222336830183, 0.025138831915904287, -0.025633121336233185, -0.05560230265273244, -0.01692369380658931, 0.08880417406065394, -0.010000621102477552, -0.052792058328481765, -0.016050114004622952, -0.07393799954375241, 0.0014118851435241178, -0.03850843534903363, 0.0010363932784845091, -0.06550875771413095, -0.0527133577207546]"
Architektur,Nachhaltige Stadtentwicklung: Konzepte und Herausforderungen,"Diese Bachelorarbeit untersucht die Konzepte und Herausforderungen der nachhaltigen Stadtentwicklung. Durch eine Kombination aus Literaturrecherche und Fallstudien werden verschiedene Ansätze und Strategien zur Förderung nachhaltiger städtischer Entwicklungen analysiert. Es wird gezeigt, dass nachhaltige Stadtentwicklung eine ganzheitliche Planung und Integration von ökologischen, sozialen und wirtschaftlichen Aspekten erfordert. Die Arbeit schließt mit Empfehlungen für Stadtplaner und Entscheidungsträger, wie sie nachhaltige Stadtentwicklungsprojekte erfolgreich umsetzen und die Lebensqualität in urbanen Räumen verbessern können.",1,f06ffa6bdd9222482668babdec8641e01cc92bbf55fecf3fde8e7f369fe07e0a,"[0.4176892092206149, -0.15621384035799687, 0.3318091337364867, 0.07301749992687473, 0.0035199194249483623, -0.043171782528780324, -0.15306653858455552, 0.08401480304975685, 0.10394001689015413, -0.01471545930602256, -0.10547451810722493, 0.01822713012177422, 0.1073586314570108, 0.07447490583528725, 0.08449487862169573, -0.26725487200158277, 0.12650648038691006, -0.06669360165368245, 0.021278120354768955, -0.009906829147588274, -0.25042216945653756, 0.07465562220213917, -0.046774429663502266, 0.04981910689541224, -0.1061590698453029]"
Architektur,Smart Cities: Technologien und ihre gesellschaftlichen Auswirkungen,"Diese Arbeit beleuchtet die Technologien und gesellschaftlichen Auswirkungen von Smart Cities. Durch eine Kombination aus Literaturrecherche und Fallstudien werden verschiedene Smart-City-Technologien wie IoT, Big Data und erneuerbare Energien analysiert. Es wird gezeigt    , dass Smart Cities das Potenzial haben, die Lebensqualität zu verbessern und Ressourcen e izienter zu nutzen, jedoch auch Herausforderungen wie Datenschutz und soziale Ungleichheit mit sich bringen. Abschließend werden Empfehlungen für die Umsetzung von Smart-City- Projekten gegeben, um die Vorteile zu maximieren und die Herausforderungen zu bewältigen.",4,d6a304fbebb730b169ef77ebf030fffd5c8a6450490f2bbb76e8c4a55447d910,"[0.3732271197019286, -0.20139992785813168, -0.1397065942852242, 0.08574801447949536, -0.289559423360187, -0.020132864230826598, 0.1923418083342988, 0.011451076188243358, 0.025172944874493765, 0.09029042110017065, -0.03554991604250162, -0.2253750134722016, -0.277014105190678, -0.1476066318354907, 0.26075185323242195, 0.00342172200213923, 0.19568821571338504, -0.10852496265722528, -0.17492130598375477, -0.22707773693692063, -0.06691751048359632, 0.1663326957852907, -0.25339740142843553, -0.041970000556142584, 0.1579809909494446]"
Architektur,Nachhaltige Architektur: Materialien und Methoden,"Diese Bachelorarbeit untersucht nachhaltige Architektur und die Verwendung umweltfreundlicher Materialien und Methoden. Durch eine Kombination aus Literaturrecherche und Fallstudien werden verschiedene nachhaltige Baumaterialien wie Holz, Recyclingbeton und natürliche Dämmsto e analysiert. Es wird gezeigt, dass nachhaltige Architektur einen wesentlichen Beitrag zur Reduktion von CO2-Emissionen und zur Schonung natürlicher Ressourcen leisten kann. Abschließend werden Empfehlungen für Architekten und Bauunternehmen gegeben, wie sie nachhaltige Materialien und Methoden in ihren Bauprojekten integrieren können.",1,6fdb6efcba768abd843585c1580c8051fa603f413646989157063f4c2398ce3a,"[0.2969683712341153, -0.14865839243841306, 0.31304510485694753, 0.06684298350610365, 0.015131513340015909, 0.03043770126180683, -0.2093676293726809, 0.10239114608765554, 0.040842737052839216, 0.11979264560982576, -0.069054822128379, -0.11564893572141419, 0.10835435792406967, 0.09267443734952766, 0.2273730964646616, -0.02363713917799145, -0.04309592334880191, 0.093010875732659, 0.10634879909822673, 0.10544968521835098, 0.056185197627226034, -0.007455571024706111, -0.18596174994089293, -0.03782851931817852, 0.026560870990521925]"
Industriedesign,User Experience Design: Prinzipien und Best Practices,"Diese Arbeit untersucht die Prinzipien und Best Practices des User Experience (UX) Designs. Durch eine Kombination aus Literaturrecherche und Fallstudien werden verschiedene Aspekte des UX-Designs, darunter Benutzerfreundlichkeit, Ästhetik und Interaktionsdesign, analysiert. Es wird gezeigt, dass ein gelungenes UX-Design entscheidend für die Zufriedenheit und Loyalität der Nutzer ist. Die Arbeit schließt mit Empfehlungen für Designer und Entwickler, wie sie die Prinzipien des UX-Designs in ihre Projekte integrieren und die Nutzererfahrung kontinuierlich verbessern können.",2,e5fbbfd7f78d41a92143a662fbc11104556057ce227eaf7c862d13b08d4888c3,"[0.2568488024362841, -0.014104254017072817, 0.0478779972096621, -0.022003759039753126, -0.0034244204070653594, 0.0020154895374143076, -0.06884880191048473, -0.0514774200972004, 0.006622455602045664, -0.07464670812961596, 0.01644608704717083, 0.021264914094981893, -0.05550241648385687, 0.014069903587535721, -0.03509065053223774, 0.02978071278354365, 0.05969226625591123, 0.01644505080445039, -0.040253707013390316, -0.0341359405971036, -0.006000784567064353, -0.052504214696134414, -0.040386012063195545, -0.041523533931242126, -0.09937332657976626]"
Industriedesign,Nachhaltiges Produktdesign: Strategien und Beispiele,"Diese Bachelorarbeit untersucht nachhaltiges Produktdesign und verschiedene Strategien zur Förderung von Umweltfreundlichkeit und Ressourcene izienz. Durch eine Kombination aus Literaturrecherche und Fallstudien werden erfolgreiche Beispiele nachhaltiger Produktdesigns analysiert. Es wird gezeigt, dass nachhaltiges Produktdesign nicht nur ökologische Vorteile bietet, sondern auch wirtschaftliche und soziale Vorteile für Unternehmen und Konsumenten. Abschließend werden Empfehlungen für Designer und Unternehmen gegeben, wie sie nachhaltige Designstrategien in ihre Produktentwicklung integrieren können.",1,fb041d5cb19fc5202de1fe0b9528d6a283817706efe5886a9ff37548d327787e,"[0.317297645265703, -0.12118985760954115, 0.1976150184256563, 0.09333872485459747, -0.00457048540075902, 0.08591862295609558, -0.20501114089879308, 0.06807147868189276, 0.019006200790549207, 0.11516399842550872, 0.07009800191097851, -0.07456248234939636, -0.07468865005745935, -0.04675262336402137, 0.0053835149178844835, 0.08726113297918485, -0.061553464516630976, -0.033958826986917226, 0.028789865167989107, -0.017158293015251944, 0.18941705909922657, -0.06198630601968552, -0.0069298859278659935, 0.0015515402115181115, 0.006048719236205313]"
Industriedesign,Innovatives Design im Zeitalter der Digitalisierung,"Diese Arbeit beleuchtet die Rolle von innovativem Design im Zeitalter der Digitalisierung. Durch eine Kombination aus Literaturrecherche und Fallstudien werden verschiedene digitale Designtechnologien und -methoden analysiert. Es wird gezeigt, wie digitale Werkzeuge und Techniken das Designprozess revolutionieren und neue kreative Möglichkeiten erö nen. Die Arbeit schließt mit Empfehlungen für Designer, wie sie digitale Technologien nutzen können, um innovative und benutzerzentrierte Produkte zu entwickeln.",5,75ae22f1590a77e5ee57ced913f8d786eb82b4701df6f4df515465c711874b7d,"[0.319327136115608, -0.10933947077650319, -0.05853190869254329, 0.04384582386739072, -0.09251107060442712, 0.11110532550046878, -0.04424990255461849, -0.010552895502545685, -0.003975518865776858, -0.013658452249534254, 0.06327012350102737, -0.12110743340291429, -0.015530235458814542, -0.008736184300877753, -0.1133622383794202, 0.07610487252359135, 0.14298990538784953, -0.062032177645179896, -0.041652090580297854, 0.07948514675924354, -0.07152483194034857, -0.00043259433912262263, 0.06290070082584258, 0.03641128537677854, 0.014564967682789427]"
Maschinenbau,Automatisierung und die Zukunft der Arbeit,"Diese Arbeit befasst sich mit der Automatisierung und ihren Auswirkungen auf die Arbeitswelt der Zukunft. Durch den Einsatz von Robotern und KI-Systemen verändern sich Arbeitsprozesse und Anforderungen an Mitarbeiter. Anhand von Literaturrecherchen und Fallstudien wird analysiert, welche Berufe und Branchen besonders von der Automatisierung betro en sind und welche neuen Möglichkeiten entstehen. Es wird diskutiert, wie Bildung und Weiterbildung an die veränderten Anforderungen angepasst werden können, um die Beschäftigungsfähigkeit der Arbeitskräfte zu sichern. Die Arbeit schließt mit politischen und wirtschaftlichen Handlungsempfehlungen.",7,4b1b738f4edc855deb228b4fbe20a2ca0318889004a4cbfdfbf08430210e4616,"[0.3799968159972106, -0.0720408177217569, -0.19366882609117309, 0.02710419555518357, -0.12169991614131814, -0.11431755773271873, -0.030293658355970213, -0.03169899843904023, 0.014171384360249537, -0.19753546017240553, 0.11639312015498224, 0.22381667417454118, 0.4810090146294849, 0.041795093918528634, 0.09267839840473507, -0.0901141342996066, 0.02198402386528204, 0.0780036338953714, -0.02296668568879528, 0.02145260769124423, 0.15584250892675258, 0.18293400541060323, -0.13590303450667837, -0.05178565783381776, 0.07739017449224356]"
Maschinenbau,Energiee izienz in der industriellen Produktion,"Diese Bachelorarbeit untersucht die Energiee izienz in der industriellen Produktion und verschiedene Strategien zur Reduktion des Energieverbrauchs. Durch eine Kombination aus Literaturrecherche und Fallstudien werden verschiedene energiee iziente Technologien und Methoden analysiert. Es wird gezeigt, dass Energiee izienz nicht nur ökologische Vorteile bietet, sondern auch wirtschaftliche Einsparungen für Unternehmen ermöglicht. Abschließend werden Empfehlungen für Unternehmen gegeben, wie sie ihre Energiee izienz verbessern und nachhaltige Produktionsprozesse implementieren können.",1,5b2618c6e2fb33092bdd71274d72c09b4b26e8e15ce263aec9c94b2e0bcd1c49,"[0.2934123405564542, -0.16451367380203857, 0.19909445080920368, 0.07999644149296203, 0.005590958330199633, 0.14595014291845718, -0.22670219807968317, 0.07765487406818297, -0.0166052604003178, 0.15718641148727433, 0.048691884842215656, -0.16953562466502795, -0.1315067396001873, -0.013319419646749587, 0.03387115369713707, 0.17336477751319143, -0.09094708509478813, 0.04207480585257958, 0.028692002326842086, -0.0895532000977303, 0.38314349291795097, -0.0661187260498864, -0.12223357127992666, -0.06916761866267446, -0.0021062458420131156]"
Maschinenbau,3D-Druck in der Fertigung: Potenziale und Herausforderungen,"Diese Arbeit untersucht die Potenziale und Herausforderungen des 3D-Drucks in der Fertigung. Durch eine Kombination aus Literaturrecherche und Fallstudien werden verschiedene Anwendungen des 3D-Drucks in der Industrie analysiert, darunter Prototyping, Kleinserienproduktion und Ersatzteilefertigung. Es wird gezeigt, dass der 3D-Druck erhebliche Vorteile in Bezug auf Flexibilität, Kostene izienz und Materialeinsparung bietet, jedoch auch Herausforderungen wie hohe Investitionskosten und technische Einschränkungen mit sich bringt. Abschließend werden Empfehlungen für die Implementierung von 3D-Drucktechnologien in der Fertigung gegeben.",9,18dea87fe154c5edd4454369888d6e526f239413c57313a355c6c95900ffdc1e,"[0.2870391987843478, -0.08184546610095325, 0.0076050091850980665, -0.003264427106787988, 0.01922249532281682, 0.16379388119274385, 0.0061297061754756015, -0.0922761677290223, -0.14946244433386793, 0.09661157703320203, 0.0026102853364752677, 0.018545242515443584, -0.00033623612485100146, -0.00815526507757881, -0.025488807209197318, 0.030388879271944325, -0.0918237046165529, 0.026445129740148614, -0.03631641791892125, -0.03237069250881266, 0.058843088259438514, -0.055394564675408424, 0.06649331164591675, -0.02496863992053726, 0.03406292206277889]"
Elektrotechnik,Erneuerbare Energien: Potenziale und Herausforderungen,"Diese Arbeit beleuchtet die Potenziale und Herausforderungen erneuerbarer Energien. Durch eine umfassende Literaturrecherche werden verschiedene erneuerbare Energiequellen wie Solar-, Wind- und Wasserkraft analysiert. Die Arbeit zeigt, dass erneuerbare Energien erheblich zur Reduktion von Treibhausgasemissionen und zur nachhaltigen Energieversorgung beitragen können. Gleichzeitig werden Herausforderungen wie technologische Entwicklung, Speicherlösungen und politische Rahmenbedingungen diskutiert. Abschließend werden Strategien und Handlungsempfehlungen zur Förderung und Integration erneuerbarer Energien gegeben.",10,5f645a9abe58ca776ca0d2073da2360a25fa0fb6cb0c76fd0cfe20bbe1c1c14c,"[0.330754291545207, -0.2639913322445301, 0.28047420432981424, 0.20260628951954443, -0.19354651096564837, -0.24319232284218592, 0.6891994297508494, 0.14871850805848225, 0.009412482479442957, 0.01175717305828153, 0.09249852134449318, 0.005910200887434608, -0.03371190529706091, 0.0776234298616971, -0.16360658364372632, 0.04544687538471683, -0.05820671815103573, 0.07623558858377834, 0.10956939461734747, 0.024705710305517922, 0.09229830459167504, 0.010863522369919167, 0.018378232015238607, 0.029536355515945637, -0.08635818443556331]"
Elektrotechnik,Smart Grids: Technologien und Anwendungen,"Diese Bachelorarbeit untersucht die Technologien und Anwendungen von Smart Grids. Durch eine Kombination aus Literaturrecherche und Fallstudien wird gezeigt, wie Smart Grids zur Optimierung der Energieverteilung und -nutzung beitragen können. Es werden verschiedene Komponenten und Technologien von Smart Grids, darunter intelligente Zähler, Kommunikationsnetzwerke und Energiemanagementsysteme, analysiert. Die Arbeit schließt mit Empfehlungen für die Implementierung und Weiterentwicklung von Smart Grids, um die Energiee izienz zu steigern und die Integration erneuerbarer Energien zu fördern.",4,d1e07e7c29f0f8bf960862b0e1ad21ba3f62542dcb2c171721b2f1a6e60426bd,"[0.31489063446789023, -0.11874651740488985, 0.01459608689215913, 0.04975169061176029, -0.13390328394590062, -0.018551193056639326, 0.13635964335884987, 0.057047126445926216, -0.031222204737574456, 0.07900707621153119, 0.02878508776983852, -0.1689540617156344, -0.16568016454514645, -0.062342941253054576, 0.12530548234343444, 0.0006257701572040977, 0.14389046686536391, -0.038790575233124465, -0.09953616074390917, -0.1563458465688895, 0.04071063966215554, 0.11324318559965008, -0.1509977425994706, -0.06600520801590737, 0.10751212824203647]"
Elektrotechnik,Energieautarke Gebäude: Konzepte und Technologien,"Diese Arbeit untersucht die Konzepte und Technologien energieautarker Gebäude. Durch eine Kombination aus Literaturrecherche und Fallstudien werden verschiedene Ansätze zur Erzeugung und Speicherung von Energie in Gebäuden analysiert. Es wird gezeigt, dass energieautarke Gebäude erheblich zur Reduktion des Energieverbrauchs und zur Unabhängigkeit von externen Energiequellen beitragen können. Abschließend werden Empfehlungen für Architekten, Ingenieure und Bauherren gegeben, wie sie energieautarke Konzepte und Technologien in ihren Projekten umsetzen können.",1,2f3540cdeba6a178d75291c752984b36ff1e24ac76e8d700830860196de3bdb3,"[0.3235102887185183, -0.1696632478988678, 0.18969656428644716, 0.09312878148224646, 0.0016574191559112572, -0.031880659367957996, -0.025173201492673686, 0.045125314199801106, 0.044398727599097715, 0.03233521314635717, -0.06477591380226973, -0.06370814952616588, -0.006810491667010589, 0.051349498966599474, 0.024293315885707975, 0.008316131206644624, -0.018390952152842244, 0.040771278841283926, -0.029382252660936983, 0.024511411733818583, 0.07089001354290402, -0.005276649500281727, 0.009772201634174096, -0.008639290403134875, 0.012374633027292777]"
Datenanalyse,Big Data und Datenschutz: Eine rechtliche Analyse,"Diese Bachelorarbeit untersucht die rechtlichen Aspekte von Big Data im Zusammenhang mit Datenschutz. Anhand von Literaturrecherchen und Fallstudien werden die Herausforderungen der Datenverarbeitung und -speicherung großer Datenmengen analysiert. Es wird aufgezeigt, welche gesetzlichen Rahmenbedingungen, wie die DSGVO, eingehalten werden müssen und welche rechtlichen Konsequenzen bei Verstößen drohen. Die Arbeit schließt mit Empfehlungen für Unternehmen, wie sie den Datenschutz in ihren Big-Data-Projekten sicherstellen und gleichzeitig die Potenziale von Big Data nutzen können.",8,46bf077632362b10c883075cbb08dd5554f52732f0452c29639a393ba5490ebc,"[0.32674224324576684, -0.2451012728404662, -0.2797801443611961, 0.1960677948023184, -0.3647163561039332, -0.3921559863953338, -0.17785036466040421, -0.4355613681621508, 0.17497822168830982, 0.15789603203859004, -0.27232708311432213, 0.03228985736832257, -0.02613851262810229, 0.09828397216918831, -0.00017453646544072013, 0.015028032203837477, -0.1761327425220009, 0.046567064063717356, -0.0035675235570396405, 0.011926377928287588, -0.008989309099318308, -0.05593812522269648, 0.0471140227668974, -0.016317317753119308, -0.0766082765175541]"
Datenanalyse,Datengetriebene Geschäftsmodelle: Chancen und Herausforderungen,"Diese Arbeit untersucht datengetriebene Geschäftsmodelle und deren Chancen und Herausforderungen für Unternehmen. Durch eine Kombination aus Literaturrecherche und    Fallstudien werden verschiedene Geschäftsmodelle analysiert, die auf der Nutzung großer Datenmengen basieren. Es wird gezeigt, dass datengetriebene Geschäftsmodelle erhebliche Wettbewerbsvorteile bieten können, jedoch auch Herausforderungen wie Datenschutz, Datenqualität und ethische Fragen mit sich bringen. Abschließend werden Empfehlungen für Unternehmen gegeben, wie sie erfolgreiche datengetriebene Geschäftsmodelle entwickeln und implementieren können.",5,f692afa0aa12010de8153cb829725b420d0811d93122f97bce842ef3dd3b9691,"[0.2876738399303377, -0.11729579474857932, -0.07230656550124849, 0.060011906563740586, -0.02963215032024069, 0.06032002532444339, -0.0707989230378148, -0.013387667073235104, 0.009127160429557173, 0.02540659241554337, 0.005611382920503866, 0.05773896021714018, -0.04240781995745805, -0.03115685075806716, -0.08940252170672829, 0.09347360694406627, -0.026347440708995834, -0.062008803585086675, 0.026975534823752867, -0.10345274703292182, 0.048571207595352786, -0.0070501044521575, 0.09034530646200467, 0.018131460655325463, 0.0987162229578005]"
Datenanalyse,Machine Learning in der Wirtschaft: Anwendungen und Potenziale,"Diese Bachelorarbeit untersucht die Anwendungen und Potenziale von Machine Learning in der Wirtschaft. Durch eine Kombination aus Literaturrecherche und Fallstudien werden verschiedene Einsatzbereiche von Machine Learning, darunter Prognosemodelle, Automatisierung und Kundenanalyse, analysiert. Es wird gezeigt, dass Machine Learning erhebliche E izienz- und Innovationspotenziale bietet, jedoch auch Herausforderungen wie Datenverfügbarkeit und -qualität mit sich bringt. Abschließend werden Empfehlungen für Unternehmen gegeben, wie sie Machine-Learning-Technologien erfolgreich in ihre Geschäftsprozesse integrieren können.",9,384756d1e5336e06c036cab459e4997ff187f87f296991d64d3a8430c4d7b7ba,"[0.27310649707497975, -0.12102784529807867, 0.0031548850694449455, 0.043147793099679976, -0.045048925921531424, 0.17802333335073728, -0.07678573628349024, -0.051760869932632445, -0.22903985409393895, 0.1543064683101711, 0.015927672676241508, 0.1323102108738625, -0.06169812557308839, 0.0037629382317425778, -0.08194001616213879, -0.060402991434969924, 0.0545701025920076, 0.14581245005430413, 0.02236575726131608, 0.03850034919581403, 0.059114434881585506, 0.11567274855528561, -0.05448035097350314, 0.09742298109758199, -0.03022644966731038]"
