topic,title,text,cluster,id_hash,vector
Soziale Arbeit im Gesundheitswesen,Einfluss von sozialer Unterstützung auf die Gesundheitsversorgung,"Diese Arbeit untersucht den Einfluss sozialer Unterstützung auf die Gesundheitsversorgung und das Wohlbefinden von Patienten. Durch eine Kombination aus Literaturrecherche und empirischen Studien wird gezeigt, dass soziale Unterstützung positive E ekte auf die Genesung und das Wohlbefinden von Patienten haben kann. Es werden verschiedene Formen der sozialen Unterstützung analysiert, darunter familiäre Unterstützung, Peer-Support-Gruppen und professionelle Sozialarbeit. Abschließend werden Empfehlungen für das Gesundheitswesen gegeben, wie sie soziale Unterstützung in die Gesundheitsversorgung integrieren und dadurch die Patientenversorgung verbessern können.",12,83bb81e79746849abb07544a79e00bda25999b0a49ba68ddfe2e45725ceb6f4a,"[0.32090737890738347, 0.13860863056466818, -0.00229149174793717, -0.1462241607150221, -0.07551400667726459, -0.05112074839847144, -0.026661432893529752, 0.08812843392722766, -0.013306783769205629, 0.04695063207707765, -0.013829445081109375, -0.05553537766231582, -0.028062941192658727, -0.025694903131235406, 0.038785348811947014, -0.005375740284608051, 0.0006350190236895423, -0.05002329245035657, 0.07827123166745274, -0.06817644712236243, -0.019864134276200242, -0.06233290293742345, 0.03002116203926509, -0.013636925925236477, -0.032957117063404234]"
Medien und Gesellschaft,Einfluss von Social Media auf die politische Meinungsbildung,"Diese Bachelorarbeit untersucht den Einfluss von Social Media auf die politische Meinungsbildung. Durch eine Kombination aus Literaturrecherche und empirischen Studien wird gezeigt, dass Social Media eine bedeutende Rolle bei der Verbreitung politischer Informationen und der Mobilisierung politischer Bewegungen spielt. Es werden verschiedene Mechanismen analysiert, durch die Social Media die politische Meinungsbildung beeinflusst, darunter Algorithmen, Filterblasen und Fake News. Abschließend werden Empfehlungen für den verantwortungsvollen Umgang mit Social Media und die Förderung einer informierten politischen Meinungsbildung gegeben.",3,b4105e2f8b9b40cae81f17511c6c359eebf5d2e6e3c781398b40955ca8f6c82e,"[0.30375581888968284, 0.5500191233136625, -0.01908814985452885, 0.609100439000921, 0.029141711720757024, 0.08021566814613892, 0.04918782104122487, 0.029474850241347255, -0.009604063084534244, 0.010587322820705148, -0.11163994454362393, 0.041724106097884774, 0.019364818380285295, 0.03063237821675019, 0.035531890703184285, 0.016867439496117607, -0.07260456289303971, 0.008302088409414649, -0.05590309844091041, -0.025600701716312246, -0.01589614919997815, -0.0028657506185596976, -0.017754198659556717, 0.020611825595101968, -0.0033980663451725623]"
Medien und Gesellschaft,Digitaler Journalismus: Chancen und Herausforderungen,"Diese Arbeit untersucht die Chancen und Herausforderungen des digitalen Journalismus in der modernen Medienlandschaft. Durch eine Kombination aus Literaturrecherche und Fallstudien wird analysiert, wie digitale Technologien den Journalismus verändert haben und welche neuen Möglichkeiten und Probleme dadurch entstanden sind. Es wird gezeigt, dass digitaler Journalismus schnellere und vielfältigere Berichterstattung ermöglicht, jedoch auch Herausforderungen wie Fake News, Monetarisierung und ethische Fragen mit sich bringt. Abschließend werden Empfehlungen für Journalisten und Medienhäuser gegeben, um die Vorteile des digitalen Journalismus optimal zu nutzen und die Herausforderungen zu bewältigen.",11,8c9003d690d8f29678046dbb5689b5c8e9e03d1fa913e52605a13aca6ec9b981,"[0.40383044125283435, -0.1984694332779683, -0.27445195927844857, 0.048925672402370425, -0.09485446538823837, 0.5988597579321792, 0.1279288981737537, 0.018176225415700593, 0.3683360671436692, -0.24355644828506448, -0.016949255194317843, -0.12613774413283516, 0.01564445747881639, 0.08496032564806721, 0.026731353992327657, -0.046906856648611855, -0.15833416260821814, -0.0037687248828592044, 0.06097002127271009, 0.057812573348333375, -0.042788530731173634, -0.05409038285215012, -0.015759672109944285, 0.09064666197153098, -0.18159151692848324]"
Medien und Gesellschaft,Einfluss von Medien auf die ö entliche Wahrnehmung von Klimawandel,"Diese Bachelorarbeit untersucht den Einfluss von Medien auf die ö entliche Wahrnehmung des Klimawandels. Durch eine Kombination aus Literaturrecherche und empirischen Studien wird gezeigt, dass Medien eine entscheidende Rolle bei der Vermittlung von Informationen und der Gestaltung der ö entlichen Meinung zum Klimawandel spielen. Es werden verschiedene Medientypen und deren Berichterstattung analysiert, darunter Nachrichtenmedien, soziale Medien und Dokumentarfilme. Abschließend werden Empfehlungen für eine ausgewogene und faktenbasierte Berichterstattung gegeben, um das ö entliche Bewusstsein und die Handlungsbereitschaft im Hinblick auf den Klimawandel zu fördern.",13,09bdc5aed7d67a48c158607edb20e6be525eb7de75aaa95ec18a422933c12676,"[0.3761871317936887, 0.20704147919403554, -0.058534565572070395, -0.13552084859904634, 0.1658136976625569, 0.010251936933187858, 0.11498579742040471, -0.08072723112444476, 0.4590901359818535, 0.38424584097379894, 0.14384067003875148, -0.005882633366803154, 0.003421135364397349, -0.1757004014280792, -0.03186763261860189, -0.11649973318179624, 0.1594625996668619, 0.2173526610415297, -0.24279155482577883, 0.16950638929204498, 0.13353803402650827, 0.04380912010048523, 0.0997949287744634, -0.013424093467401933, 0.03031057907422534]"
Unternehmenskommunikation,Bedeutung von Corporate Social Responsibility in der Unternehmenskommunikation,"Diese Arbeit untersucht die Bedeutung von Corporate Social Responsibility (CSR) in der Unternehmenskommunikation. Durch eine Kombination aus Literaturrecherche und Fallstudien wird gezeigt, dass CSR eine wichtige Rolle bei der Verbesserung des Unternehmensimages und der Kundenbindung spielt. Es werden verschiedene Strategien der CSR-Kommunikation analysiert, die sich als besonders wirksam erwiesen haben, darunter Nachhaltigkeitsberichte, soziale Projekte und transparente Kommunikation. Abschließend werden Empfehlungen für Unternehmen gegeben, wie sie ihre CSR-Strategien und - Kommunikation optimieren können, um das Vertrauen und die Loyalität ihrer Stakeholder zu stärken.",5,cdb523e83b259be31e5c7025f153ac1236f37b29ed703b38e86769f2c81ce7c7,"[0.3220511133386486, 0.1480175686797467, 0.0340967204321469, 0.036404582584834436, -0.06531493582945427, -0.004191358988271716, -0.07190828383467487, 0.0002190026479412525, -0.011689992172454942, -0.04932751026627724, 0.1276812607237546, -0.03917004791683764, -0.07918464540308874, -0.06854338778034261, -0.06747353174371822, -0.015552995912041692, -0.052045869596426486, -0.02668383376373115, -0.0008523069219740614, -0.05612667086264925, -0.014701665246768459, 0.024169135325592783, 0.03380073865630071, -0.042573699267887684, -0.11126133353118771]"
Unternehmenskommunikation,Einfluss von interner Kommunikation auf die Mitarbeiterzufriedenheit,"Diese Bachelorarbeit untersucht den Einfluss der internen Kommunikation auf die Zufriedenheit und das Engagement der Mitarbeiter. Durch eine Kombination aus Literaturrecherche und empirischen Studien wird gezeigt, dass eine e ektive interne Kommunikation entscheidend für die Motivation, das Vertrauen und die Bindung der Mitarbeiter ist. Es werden verschiedene Kommunikationsstrategien und -kanäle analysiert, die sich besonders positiv auf die Mitarbeiterzufriedenheit auswirken. Abschließend werden Empfehlungen für Unternehmen gegeben, wie sie ihre interne Kommunikation verbessern und dadurch die Zufriedenheit und das Engagement ihrer Mitarbeiter steigern können.",12,a21e61a03ac93e05a3874d8a934681bfbba2cb8b01913552feea3ba7034d9f2e,"[0.3902585597381681, 0.1698193690314324, 0.010484255224236428, -0.11556944930629404, -0.12990602696256573, -0.067834006906899, -0.14901716366722054, 0.045403145946851485, 0.0020222450072855296, -0.14274058898097292, 0.19469394167489265, 0.006541292777337722, -0.025458949039261405, -0.021878242580509133, -0.1830642790923205, 0.07816226645447845, 0.012203920670958731, 0.07434427092222921, -0.09036979184039694, -0.3020206422773619, 0.031767931405230224, 0.09004501110417888, -0.02812080149322189, -0.0383334897255761, -0.2588347718056021]"
Unternehmenskommunikation,Krisenkommunikation in Unternehmen: Strategien und Best Practices,"Diese Arbeit untersucht die Strategien und Best Practices der Krisenkommunikation in Unternehmen. Durch eine Kombination aus Literaturrecherche und Fallstudien wird gezeigt, wie Unternehmen in Krisensituationen e ektiv kommunizieren können, um das Vertrauen ihrer Stakeholder zu erhalten und ihre Reputation zu schützen. Es werden verschiedene Krisenkommunikationsstrategien analysiert, darunter proaktive Kommunikation, Transparenz und schnelles Handeln. Abschließend werden Empfehlungen für Unternehmen gegeben, wie sie ihre Krisenkommunikationsstrategien entwickeln und implementieren können, um im Ernstfall gut vorbereitet zu sein.",5,91f978f7a926c7bd31d5861e7a2b883b2c8e00f4676ebdcad8b0bc0faf1ba7de,"[0.2971621247218814, -0.01624682384392901, 0.04621388538535287, 0.03209415463896357, -0.10898504300532492, 0.015087682057438278, -0.15158442710739706, 0.01290679462951541, 0.03197398991146048, -0.025001654328652284, 0.22991296175575124, -0.056243645913744984, -0.10504222297917318, -0.06989160775781572, -0.0845710210438106, 0.016598258628294026, -0.0069154978416570345, -0.020652337586396723, -0.04971050652707363, -0.0933130532464545, 0.035079998721167314, 0.02240626169491101, 0.07092205710965052, -0.022136017371686793, -0.04181512831175693]"
Strafrecht,Reform des Strafvollzugs: Chancen und Herausforderungen,"Diese Bachelorarbeit untersucht die Chancen und Herausforderungen der Reform des Strafvollzugs. Durch eine Kombination aus Literaturrecherche und Fallstudien werden verschiedene Reformansätze analysiert, die auf die Verbesserung der Resozialisierung und die Reduktion der Rückfallquoten abzielen. Es wird gezeigt, dass eine    ganzheitliche und rehabilitative Herangehensweise im Strafvollzug entscheidend für den Erfolg der Resozialisierung ist. Abschließend werden Empfehlungen für die Reform des Strafvollzugs gegeben, um eine e ektivere und humanere Strafrechtspraxis zu fördern.",2,e205ace4bab6cc88b32dc91f4cfbb647eae8b11a1ecb5c6757fe1d867e24c0bc,"[0.3575366605203715, 0.019531240813134447, 0.038614667204041844, -0.07389650911723873, 0.03575664398341144, 0.042933727531539304, -0.005657941286324109, -0.03317631188849833, 0.03412748429959572, -0.06130819391869961, -0.034425452548043925, 0.035539368273074086, -0.034390785778140365, 0.004668374054617591, -0.06802660268864728, 0.0371191137763897, -0.0013425655905518565, 0.09139813441358863, -0.047114356084468796, -0.06773799945823712, -0.10469841342574136, 0.034451982718815236, -0.01629306070569821, -0.06370338853383246, 0.002003077813775647]"
Strafrecht,Einfluss von Jugendstrafrecht auf die Rückfallquote,"Diese Arbeit untersucht den Einfluss des Jugendstrafrechts auf die Rückfallquote jugendlicher Straftäter. Durch eine Kombination aus Literaturrecherche und empirischen Studien wird gezeigt, dass das Jugendstrafrecht, das auf Erziehung und Rehabilitation statt auf Strafe setzt, positive E ekte auf die Reduktion der Rückfallquote haben kann. Es werden verschiedene Ansätze und Maßnahmen des Jugendstrafrechts analysiert, die sich als besonders wirksam erwiesen haben. Abschließend werden Empfehlungen für die Weiterentwicklung und Verbesserung des Jugendstrafrechts gegeben, um die Rückfallquote weiter zu senken.",12,34912d1754410e71ba215f56138b177d56152e1f0f97eb2ef521dc8c508087e0,"[0.3061103959687222, 0.13234292027631872, -0.017885610690466076, -0.1683001675679328, -0.05658739660073316, -0.00827482110336811, 0.028925020512888998, 0.10085498558673871, 0.019534265090972825, -0.02827425250118416, -0.04877910254962803, 0.031250699108118486, -0.07452002755782676, 0.011689888553762805, 0.0951247733154654, 0.04303504919563865, -0.008606633881541528, 0.004531270006721169, 0.029574947700771858, 0.02622461992981985, -0.040209822886856705, -0.031009444784544017, -0.022323810506283345, -0.04540278482114969, -0.013422162646969238]"
Strafrecht,Ethische Herausforderungen in der Kriminalitätsprävention,"Diese Bachelorarbeit untersucht die ethischen Herausforderungen in der Kriminalitätsprävention. Durch eine Kombination aus Literaturrecherche und Fallstudien werden verschiedene Präventionsstrategien analysiert und deren ethische Implikationen diskutiert. Es wird gezeigt, dass Präventionsmaßnahmen, die auf Überwachung, Kontrolle und soziale Eingri e setzen, sowohl positive E ekte auf die Reduktion von Kriminalität als auch ethische Bedenken hinsichtlich Datenschutz, Gerechtigkeit und sozialer Stigmatisierung mit sich bringen. Abschließend werden Empfehlungen für eine ethisch verantwortungsvolle Kriminalitätsprävention gegeben.",6,c2eaa553192a2eac620136205a47bc15683501aee46e556530be9f841eea3b31,"[0.3587277019440897, -0.044081423662725785, -0.15520293358879064, -0.017553816901708996, 0.14718481843819708, -0.06417998099463541, 0.006780205026808118, 0.09400697190214938, -0.044779214390385985, 0.059521927202528385, -0.04544040973260656, -0.03977785134157438, -0.05515985737251829, -0.050059380694229924, 0.03284067448420134, 0.0034140454897073156, -0.04397138450922426, -0.06520021291129692, 0.04367088981398403, 0.030398728918827188, -0.0011173678673621536, -0.056499571527883694, 0.0024330475766533525, 0.07380318211973241, 0.018965675740272903]"
Kriminologie,Soziologische Theorien zur Entstehung von Kriminalität,"Diese Arbeit untersucht verschiedene soziologische Theorien zur Entstehung von Kriminalität. Durch eine Kombination aus Literaturrecherche und empirischen Studien werden verschiedene Theorien analysiert, darunter die Anomietheorie, die Subkulturtheorie und die Theorie der sozialen Desorganisation. Es wird gezeigt, dass soziale und wirtschaftliche Faktoren eine entscheidende Rolle bei der Entstehung von Kriminalität spielen. Abschließend werden die Implikationen dieser Theorien für die Kriminalitätsprävention und -bekämpfung diskutiert und Empfehlungen für die Praxis gegeben.",2,babd7cdfe5c0f7f3ff0c102f96d94e24a784eebb28c0048e85401789024e0cf4,"[0.36047059778736323, 0.08249730130186936, 0.027759085107221373, -0.07054640646366049, 0.10539313314085384, -0.07016328797998257, 0.05598881985648662, -0.08343973460420674, 0.03251314411767194, 0.07962460077487912, 0.035164142082347784, -0.0042436898729105894, -0.02415565132523198, 0.0008581445078326104, 0.05960390120020467, -0.08412335874902471, 0.024196826971142952, -0.07357812449219409, 0.0035413198257402407, 0.03790222727985867, 0.027902332584476268, -0.04996010713250094, 0.03760045991574306, 0.06987517794715971, 0.014207598612891862]"
Kriminologie,Einfluss von Medien auf die ö entliche Wahrnehmung von Kriminalität,"Diese Bachelorarbeit untersucht den Einfluss von Medien auf die ö entliche Wahrnehmung von Kriminalität. Durch eine Kombination aus Literaturrecherche und empirischen Studien wird gezeigt, dass Medien eine bedeutende Rolle bei der Darstellung und Wahrnehmung von Kriminalität spielen. Es werden verschiedene Medientypen und deren Berichterstattung analysiert, darunter Nachrichtenmedien, Filme und Serien. Abschließend werden Empfehlungen für eine ausgewogene und faktenbasierte Berichterstattung gegeben, um die ö entliche Wahrnehmung von Kriminalität zu verbessern und Verzerrungen zu vermeiden.",13,5fcb5b42546c698d881d0448487269aa2a5a5ba746c4b012c229886b35405705,"[0.3219439247944143, 0.15575139763551424, -0.02718816956400781, -0.08456165322490898, 0.059601528599308756, 0.007745199694494225, 0.08392012161451108, -0.08233640810037976, 0.3124136623331404, 0.25895595439738, 0.1354957362319775, -0.10720652367415703, 0.00906867257523431, -0.12163184083605018, 0.03675523252680887, -0.1822203929472195, 0.1656140151365537, 0.17056873569231307, -0.22168129041504375, 0.17062568455370639, 0.10315861696189253, 0.057509724173571926, 0.1223874145026729, 0.020648073038852383, 0.048392942303946127]"
Kriminologie,Bedeutung von Opferhilfe in der Kriminalitätsbekämpfung,"Diese Arbeit untersucht die Bedeutung von Opferhilfe in der Kriminalitätsbekämpfung und deren Einfluss auf die Rehabilitation von Opfern und die Prävention von Rückfällen. Durch eine Kombination aus Literaturrecherche und Fallstudien wird gezeigt, dass Opferhilfe eine entscheidende Rolle bei der Unterstützung von Kriminalitätsopfern spielt und deren Wiedereingliederung in die Gesellschaft fördert. Es werden verschiedene Formen der Opferhilfe analysiert, darunter psychologische Betreuung, rechtliche Unterstützung und soziale Dienstleistungen. Abschließend werden Empfehlungen für die Weiterentwicklung und Verbesserung der Opferhilfe gegeben.",2,304ca5ac8b6248e47f00a27260dff67ce060a83efe8ca67d7b8c4a678528cf43,"[0.3368494054081777, 0.10285634101574116, 0.021169085292086616, -0.07826589529159518, 0.04732925894260001, -0.03406951549824092, 0.022136683319820685, -0.11942965161247002, -0.05446108272327877, 0.05428516295815007, 0.026665839832885275, -0.08681617909921945, 0.038640239865282616, -0.0328646859890233, 0.017569731732484432, -0.03062227244866455, -0.05375170658903445, -0.05097065918498949, 0.038519378438346207, -0.0060318857425553495, 0.007609092649583267, 0.007986052475193331, 0.04699019550146283, 0.011936213429982143, -0.022308951664462225]"
Betriebswirtschaftslehre,Digitalisierung im Mittelstand: Chancen und Risiken,"Diese Bachelorarbeit untersucht die Chancen und Risiken der Digitalisierung im Mittelstand. Durch eine Kombination aus Literaturrecherche und Fallstudien werden verschiedene digitale Technologien und deren Anwendungen im Mittelstand analysiert. Es wird gezeigt, dass die Digitalisierung erhebliche Potenziale zur E izienzsteigerung und Innovationsförderung bietet, jedoch auch Herausforderungen wie technische Barrieren und Datenschutz mit sich bringt. Abschließend werden Empfehlungen für mittelständische Unternehmen gegeben, wie sie die Digitalisierung erfolgreich nutzen und die Herausforderungen bewältigen können.",9,9ec40be188ca57cba09bd7a94ebe441eac81e39af0ebd65ca797b1fb233aa8f3,"[0.427052026244044, -0.2232567194845192, -0.09433891125959601, 0.08937221435815033, -0.06985013640125648, 0.2069312400216019, -0.04107933710767781, -0.046055061315209464, -0.14792142002451378, 0.09213779865393765, -0.03322366213337562, 0.04969788446848427, -0.05349953428524679, -0.05698933001739962, -0.17338597347714926, 0.1217132583375554, 0.15402437936035157, -0.05162033205977643, -0.07561405590634479, -0.005108154416565936, -0.10359416704801773, -0.01568314950989546, 0.16809501467157248, 0.1429088777181557, 0.08172154117224757]"
Betriebswirtschaftslehre,Einfluss von Unternehmensführung auf die Mitarbeiterzufriedenheit,"Diese Arbeit untersucht den Einfluss von Unternehmensführung auf die Zufriedenheit und das Engagement der Mitarbeiter. Durch eine Kombination aus Literaturrecherche und empirischen Studien wird gezeigt, dass eine e ektive und mitarbeiterorientierte Unternehmensführung entscheidend für die Motivation, das Vertrauen und die Bindung der Mitarbeiter ist. Es werden verschiedene Führungsstile und -strategien analysiert, die sich besonders positiv auf die Mitarbeiterzufriedenheit auswirken. Abschließend werden Empfehlungen für Unternehmen gegeben, wie sie ihre Unternehmensführung verbessern und dadurch die Zufriedenheit und das Engagement ihrer Mitarbeiter steigern können.",12,3be35a2d9955f0413515a147b8b7e67a42869e38c3f353d2cc037e483a456010,"[0.40097295298522206, 0.13140381887452435, 0.020738090770117856, -0.13210123008202282, -0.1356228286357119, -0.0833769301765534, -0.13533821190396603, 0.056426234325907175, 0.010175791567078325, -0.14043973747664884, 0.19617494943669767, 0.017607038420720797, -0.02240611986543428, -0.00843674250885034, -0.16146108709034884, 0.061708916718862104, 0.022390268772901106, 0.0713819039154155, -0.08477355489351668, -0.2664803063246459, 0.04574868576696938, 0.07542226691825266, -0.03196434985839112, -0.03903822301007708, -0.22296485908644345]"
Betriebswirtschaftslehre,Ethische Verantwortung von Unternehmen im globalen Markt,"Diese Bachelorarbeit untersucht die ethische Verantwortung von Unternehmen im globalen Markt. Durch eine Kombination aus Literaturrecherche und Fallstudien werden verschiedene Aspekte der Unternehmensethik analysiert, darunter faire Arbeitsbedingungen, Umweltverantwortung und Transparenz. Es wird gezeigt, dass ethische Unternehmenspraktiken nicht nur zur Verbesserung des Unternehmensimages und der Kundenbindung beitragen, sondern auch langfristige wirtschaftliche Vorteile bieten. Abschließend werden Empfehlungen für Unternehmen gegeben, wie sie ihre ethische Verantwortung im globalen Markt wahrnehmen und ethische Geschäftsstrategien entwickeln können.",5,be2c47f0771dec0570b617bcb541899c36e739b3ebc07ccece5a7cf8eeaa9232,"[0.2810936956537335, -0.12267432616092003, -0.046320468267287716, 0.06767077793915187, 0.1313744789187652, -0.001287067656386366, -0.13137996700495178, 0.10291686279912482, 0.06010619668977446, 0.07697213798038899, 0.11474978527879837, -0.0001548327059846802, -0.12806918684640584, -0.01315913956139963, -0.11435368018527486, 0.11483740299765142, -0.093200618420228, -0.13123812496016016, 0.03506740516192629, -0.024657522848840523, 0.08443878906468343, -0.008977663464341484, 0.03039177238777271, 0.01893879573106631, -0.025793845903846986]"
Volkswirtschaftslehre,Auswirkungen von Handelskriegen auf die globale Wirtschaft,"Diese Arbeit untersucht die Auswirkungen von Handelskriegen auf die globale Wirtschaft. Durch eine Kombination aus Literaturrecherche und empirischen Studien werden die wirtschaftlichen, sozialen und politischen Folgen von Handelskonflikten analysiert. Es wird gezeigt, dass Handelskriege erhebliche negative E ekte auf das Wirtschaftswachstum, die Arbeitsmärkte und die internationalen Beziehungen haben können. Abschließend werden Empfehlungen für politische Entscheidungsträger gegeben, wie sie Handelskonflikte vermeiden und die globale Wirtschaft durch kooperative Handelsabkommen stärken können.",12,a1975af0ea9e20d1c99b30c3afecd00fd82f099c98db84b843881c551b4b09c5,"[0.3569498634331036, 0.1000298070043162, 0.021063662478060033, -0.07373531893442103, -0.059999498360852645, -0.075839910858443, -0.008033885584281666, 0.03980072586220213, -0.017588658023038994, -0.06688595808738017, -0.0822444799370928, 0.07119149508599809, 0.0007354969133050618, -0.03412922505045722, 0.09366547261604509, 0.043244299098784286, 0.12324933920632321, -0.032557385737406144, 0.0740300811908958, 0.009734779810527873, -0.018456417884336253, -0.01916864837114558, 0.05942212276767975, 0.11272771754025972, -0.04562125261834254]"
Volkswirtschaftslehre,Einfluss von Steueroasen auf die globale Wirtschaft,"Diese Bachelorarbeit untersucht den Einfluss von Steueroasen auf die globale Wirtschaft. Durch eine Kombination aus Literaturrecherche und empirischen Studien werden die wirtschaftlichen und politischen Auswirkungen von Steueroasen analysiert. Es wird gezeigt, dass Steueroasen erhebliche Einnahmeverluste für Staaten verursachen und Ungleichheiten in der globalen Steuerpolitik verstärken können. Abschließend werden Empfehlungen für internationale Maßnahmen zur Bekämpfung von Steuerflucht und zur Förderung einer fairen und transparenten Steuerpolitik gegeben.",2,4f3bc5577462c60f77fce6d4681d6ca1a0aba05ad5e7aa04d6a1e167282133ab,"[0.29167222009697, 0.047006633552886055, 0.07475083530119006, -0.014998307966175536, 0.025506233909625194, -0.03419780222077352, 0.017638642106495024, -0.01720671868222913, -0.013013239830648084, 0.012885152362625746, -0.028327380268370814, 0.029107172516239545, 0.06911905344496791, -0.006431234742067844, 0.08128042325417582, 0.04667682403135399, 0.03336021677285233, 0.00912890159048523, 0.034050630012012834, 0.0020544574936777723, 0.003972610383146096, -0.04400990709508889, 0.033719518958155746, 0.08904449877551819, -0.0014182743892658014]"
Volkswirtschaftslehre,Bedeutung von Bildung für das Wirtschaftswachstum,"Diese Arbeit untersucht die Bedeutung von Bildung für das Wirtschaftswachstum und die Entwicklung von Volkswirtschaften. Durch eine Kombination aus Literaturrecherche und empirischen Studien wird gezeigt, dass Investitionen in Bildung positive E ekte auf die Produktivität, Innovation und soziale Mobilität haben. Es werden verschiedene Bildungspolitiken und -strategien analysiert, die sich besonders positiv auf das Wirtschaftswachstum auswirken. Abschließend werden Empfehlungen für politische Entscheidungsträger gegeben, wie sie die Bildung fördern und dadurch das langfristige Wirtschaftswachstum unterstützen können.",12,28147b27d64a9a5ea700210bad641f84abdd70729365daa765bb31f22da21ccb,"[0.36857458117139497, 0.11638965246237397, 0.012252241241953628, -0.13337863288450047, -0.1138769589552121, -0.08446449171632162, -0.027575041604140933, 0.12738740866093212, -0.014829700245414416, -0.08125353363053638, -0.0109294750908892, 0.022340734074938286, 0.003896625102746577, -0.029083961678147977, 0.010841658464192033, -0.017970246422596155, -0.024031971276675123, -0.04258792744911177, 0.01738842111418136, 0.007403025257704741, 0.06287797965109039, 0.05585441420088229, 0.008088388209935305, 0.06727739967898048, -0.03950925358663454]"
