topic,title,text,cluster,id_hash,vector
Marketing,Einfluss von Social Media auf das Kaufverhalten von Konsumenten,"Diese Arbeit untersucht den Einfluss von Social Media auf das Kaufverhalten von Konsumenten. In einer digitalisierten Welt spielen soziale Medien eine immer größere Rolle bei der Beeinflussung von Konsumentscheidungen. Durch eine Kombination aus Literaturrecherche und empirischen Studien wird gezeigt, wie Plattformen wie Facebook, Instagram und Twitter das Kaufverhalten durch gezielte Werbung und Influencer-Marketing beeinflussen. Die Ergebnisse deuten darauf hin, dass Social Media erheblich zum Aufbau von Markenbewusstsein und Kundenbindung beiträgt. Empfehlungen für Unternehmen werden gegeben, wie sie ihre Social- Media-Strategien verbessern können, um den Konsumenten besser zu erreichen.",3,91a8e3bab9ff73db82baab3d9fbcf5551658ea08ee571e16087f85c7082eaa92,"[0.2940257041887858, 0.3687580691728565, 0.00041438598788020355, 0.37335280606328675, -0.0961381308306951, 0.005598438747991762, -0.05419774487149026, 0.04943060927921563, 0.06410630199650533, 0.04939241919514477, 0.1307000476674572, -0.02087905817880532, -0.08495160952752882, -0.005130668580916373, -0.05349096033206281, -0.07178206009510563, 0.07303717909452723, 0.02045374750620446, -0.007737800005729887, 0.09558940904563387, 0.07754973577774445, 0.0023916158345784733, 0.030757849589937162, -0.04457639459320719, 0.038566413912557634]"
Marketing,Green Marketing: Strategien und Verbraucherwahrnehmung,"In dieser Arbeit wird das Konzept des Green Marketing untersucht und wie es von Verbrauchern wahrgenommen wird. Angesichts wachsender Umweltbedenken und Nachhaltigkeitstrends setzen immer mehr Unternehmen auf grüne Marketingstrategien. Durch eine umfassende Literaturrecherche und Fallstudien werden verschiedene Strategien analysiert und deren Wirksamkeit bewertet. Es wird festgestellt, dass Verbraucher zunehmend umweltbewusstere Produkte bevorzugen, wobei Transparenz und Authentizität der Unternehmen entscheidend sind. Abschließend werden Empfehlungen für die Implementierung erfolgreicher Green-Marketing-Strategien gegeben.",5,3732733bd362e098fb08eac4dc94f09fe06f47093710626635d6c131d3c2f796,"[0.2516618589367434, -0.004079911354865495, 0.05965218636393985, 0.022081049242243186, -0.03642022330136046, -0.0018518207358236825, -0.06614769489392679, -0.020662174728781936, 0.006096485240736087, -0.036621176615937175, 0.17608598228378808, 0.02097397570286856, -0.076812127632438, 0.02141683603050681, -0.08158555100848437, 0.02026240567589544, 0.020675090593291468, -0.02119927828981278, 0.04591942536708508, 0.05111956937892272, 0.04172937342805274, -0.03903600171815951, 0.029868302644222935, -0.04201338452764526, 0.006775825244888327]"
Marketing,Die Rolle von Influencern im modernen Marketing,"Diese Bachelorarbeit untersucht die Rolle von Influencern im modernen Marketing und wie sie die Werbelandschaft verändert haben. Anhand von Literaturrecherchen und Fallstudien werden die Mechanismen und Strategien von Influencer-Marketing analysiert. Es wird aufgezeigt, wie Influencer durch ihre Authentizität und Reichweite das Konsumverhalten beeinflussen und eine starke Markenbindung scha en können. Die Arbeit schließt mit Empfehlungen für Unternehmen, wie sie e ektive Influencer-Kampagnen entwickeln und die richtigen Influencer für ihre Marken auswählen können.",5,3f2484961b1f18764db0789fe27aa10deb2350e4e9faef7058ee8a8980fccea4,"[0.3355660483490567, 0.016013867442286056, 0.0034933082492789196, 0.11067442589006432, -0.22375227477505316, -0.09469458997621787, -0.2536149581353299, -0.06461098098861102, 0.10124231937749165, -0.11072072039033776, 0.33394824294653863, 0.049419507375506766, -0.1358025133950954, 0.10430949069294307, -0.23336018208787304, -0.007058170635465604, 0.25696723418604966, -0.17361196735386514, 0.3212860860121613, 0.33086435864051245, 0.14107269024405025, -0.04762504516978943, -0.04249572493132669, -0.02580381596454834, 0.07736468031554028]"
Personalwesen,Künstliche Intelligenz im Personalwesen,"Diese Arbeit beleuchtet den Einsatz von künstlicher Intelligenz (KI) im Personalwesen und ihre Auswirkungen auf HR-Prozesse. KI-Technologien wie Chatbots, automatisierte Bewerberauswahl und Datenanalyse revolutionieren das HR-Management. Durch eine Kombination aus Literaturrecherche und Fallstudien wird gezeigt, wie KI zur E izienzsteigerung und Verbesserung der Bewerbererfahrung beitragen kann. Es werden jedoch auch Herausforderungen wie Datenschutz und ethische Implikationen diskutiert. Die Arbeit schließt mit Empfehlungen für die Implementierung von KI im Personalwesen unter Berücksichtigung der technologischen und ethischen Aspekte.",6,5bc6094cbe646986d232c59bfa18987b65d17eece51032c14bbd881d53b04a9d,"[0.34289061123938896, -0.1865247464103551, -0.23980164956291344, 0.11046279923916627, 0.12524442034469532, -0.11923395909459379, -0.01438622149461321, 0.1684022322319486, -0.16739972382190482, 0.0029274180448105817, 0.07465710519084233, -0.08851310599521463, 0.1474018672202701, 0.0027156131056270873, -0.1268537228882955, -0.13337889923190988, 0.10062456341950506, -0.01739872561488525, -0.05131317558473773, 0.01790273898315691, -0.007155136079298361, -0.12320765501303163, -0.04880087457633232, 0.0015478387097522103, 0.0480258433313267]"
Personalwesen,Bedeutung von emotionaler Intelligenz in der Führung,"Diese Bachelorarbeit untersucht die Bedeutung emotionaler Intelligenz in der Führung und wie sie zur E ektivität von Führungskräften beiträgt. Anhand von Literaturrecherchen und empirischen Studien wird die Rolle emotionaler Intelligenz bei der Mitarbeiterführung, Konfliktlösung und Entscheidungsfindung analysiert. Es wird gezeigt, dass Führungskräfte mit hoher emotionaler Intelligenz besser in der Lage sind, ein positives Arbeitsklima zu scha en und die Motivation und Zufriedenheit ihrer Mitarbeiter zu steigern. Abschließend werden Trainingsmethoden zur Förderung emotionaler Intelligenz in Führungskräften vorgestellt.",5,b23a876e16dbdde48403adcc0d7c8df69595ebafe81b60d5d67c22cac9d23a87,"[0.26465432454646903, 0.0225679517502825, -0.0024650771165683743, -0.026570419600940004, -0.042126980320458404, -0.04863673210797047, -0.038510859639515255, -0.04099024537203331, -0.039342615413843325, -0.004256858918299092, 0.17327325945870736, -0.055153563936128955, 0.20444309058174293, 0.053863593956529156, -0.052852342949904874, -0.21538423505824367, -0.015775117044105, 0.021442614878908983, -0.1219000419764791, -0.20095240628569674, 0.015778835697310024, -0.12231002429684908, -0.06367990195607011, -0.06337364698515104, -0.1038391917024438]"
Personalwesen,Remote Work: Auswirkungen auf Produktivität und Arbeitszufriedenheit,"Diese Arbeit analysiert die Auswirkungen von Remote Work auf die Produktivität und Arbeitszufriedenheit von Mitarbeitern. Mit der zunehmenden Verbreitung von Telearbeit durch technologische Fortschritte und die COVID-19-Pandemie wird Remote Work immer relevanter. Durch eine Kombination aus Literaturrecherche und empirischen Untersuchungen werden sowohl positive als auch negative Aspekte von Remote Work beleuchtet. Die Ergebnisse zeigen, dass Remote Work die Work-Life-Balance verbessern kann, jedoch auch Herausforderungen wie Isolation und Kommunikationsprobleme mit sich bringt. Empfehlungen für Unternehmen zur Optimierung von Remote-Work-Strategien werden gegeben.",5,f79134244956e35b66002220b5f46f74051fffc5da31b243611709557ef14b28,"[0.21422863588263766, 0.001400296048891844, -0.033883820677787564, -0.01982901386321176, -0.07122796121487038, -0.023017105537953848, 0.010784263780357765, 0.04392275176524964, -0.05403954566961486, 0.0447345255972332, 0.02753542761288102, 0.04119067630503702, -0.011589516500579908, -0.01143557019118543, -0.031004436453407086, 0.0036730708454715526, 0.072021300426176, -0.0439456160010203, 0.06834678177904835, -0.0978920543305215, -0.013597929180298885, -0.11359166542681275, -0.11861921538368496, -0.03168788457172688, -0.17943982959582142]"
Künstliche Intelligenz,Künstliche Intelligenz in der Medizin: Chancen und Risiken,"Diese Bachelorarbeit untersucht die Anwendungsmöglichkeiten und Risiken von künstlicher Intelligenz (KI) in der Medizin. Durch eine umfassende Literaturrecherche und Fallstudien werden verschiedene Einsatzbereiche wie Diagnoseunterstützung, Behandlungsplanung und personalisierte Medizin analysiert. Die Arbeit zeigt, dass KI das Potenzial hat, die medizinische Versorgung zu revolutionieren, indem sie präzisere Diagnosen und e izientere Behandlungen ermöglicht. Gleichzeitig werden ethische und datenschutzrechtliche Herausforderungen diskutiert. Abschließend werden Empfehlungen für die Integration von KI in die medizinische Praxis unter Berücksichtigung der Sicherheits- und Ethikstandards gegeben.",6,1311251fc6d1a89d0a3547027876df192c29ed958d998812d6ccf0c43e14c762,"[0.3194768125827438, -0.10320021551581007, -0.11316291459315063, 0.056640837282932906, 0.07486080224176664, -0.08533147143285787, 0.06446275186142783, 0.08970493844298733, -0.13786265431478295, -0.008925441416396103, 0.0707967889175971, -0.08654377755130335, 0.12286258658008642, 0.02564794573706974, -0.06786852143946948, -0.15729539384998326, 0.023736998413214097, -0.03393197553748978, -0.027511773396953078, -0.030693079800618982, 0.0444133562084989, -0.08501855708562674, -0.02760194970842913, 0.008323944291552293, -0.039083319879187485]"
Künstliche Intelligenz,Automatisierung und die Zukunft der Arbeit,"Diese Arbeit befasst sich mit der Automatisierung und ihren Auswirkungen auf die Arbeitswelt der Zukunft. Durch den Einsatz von Robotern und KI-Systemen verändern sich Arbeitsprozesse und Anforderungen an Mitarbeiter. Anhand von Literaturrecherchen und Fallstudien wird analysiert, welche Berufe und Branchen besonders von der Automatisierung betro en sind und welche neuen Möglichkeiten entstehen. Es wird diskutiert, wie Bildung und Weiterbildung an die veränderten Anforderungen angepasst werden können, um die    Beschäftigungsfähigkeit der Arbeitskräfte zu sichern. Die Arbeit schließt mit politischen und wirtschaftlichen Handlungsempfehlungen.",7,fca634340d4b2a3d84a668ac837da21803c0d2f6efff2683dfea51dc17a9feff,"[0.3799968159972106, -0.0720408177217569, -0.19366882609117309, 0.02710419555518357, -0.12169991614131814, -0.11431755773271873, -0.030293658355970213, -0.03169899843904023, 0.014171384360249537, -0.19753546017240553, 0.11639312015498224, 0.22381667417454118, 0.4810090146294849, 0.041795093918528634, 0.09267839840473507, -0.0901141342996066, 0.02198402386528204, 0.0780036338953714, -0.02296668568879528, 0.02145260769124423, 0.15584250892675258, 0.18293400541060323, -0.13590303450667837, -0.05178565783381776, 0.07739017449224356]"
Künstliche Intelligenz,Einsatz von Chatbots im Kundenservice,"Diese Bachelorarbeit untersucht den Einsatz von Chatbots im Kundenservice und deren Auswirkungen auf die Kundenzufriedenheit. Durch eine Kombination aus Literaturrecherche und empirischen Studien wird gezeigt, wie Chatbots zur E izienzsteigerung und Kostensenkung im Kundenservice beitragen können. Es wird analysiert, inwieweit Chatbots in der Lage sind, menschliche Mitarbeiter zu ersetzen und welche Grenzen und Herausforderungen dabei bestehen. Die Ergebnisse deuten darauf hin, dass Chatbots eine wertvolle Ergänzung im Kundenservice darstellen, insbesondere für einfache und häufige Anfragen. Abschließend werden Empfehlungen für die Implementierung und Optimierung von Chatbot-Lösungen gegeben.",5,68dfe4bbc97ea42d1937cdfc06d72db16e0f20efda5ca5237fca6d5e87536c18,"[0.28575963161607365, -0.01630509621718786, -0.031972742925628135, -0.004887727246702402, -0.01589723864198187, -0.0050430880280206754, -0.01357444826428501, -0.0039037773582628736, -0.02336224017737173, 0.014299663347855021, 0.06846391772492955, 0.015001077191608592, 0.043396590423512314, 0.03245644406503453, -0.03565684640306406, -0.05493537636657206, 0.03660713334007777, 0.057893417465512284, -0.014008045535308402, -0.02803649237990345, -0.06380907753321123, 0.028780163214612523, 0.08726399281385211, -0.04747264651994855, 0.025461073269038112]"
IT-Sicherheit,Cybersecurity in kleinen und mittleren Unternehmen,"Diese Arbeit beleuchtet die Herausforderungen und Lösungsansätze der Cybersecurity in kleinen und mittleren Unternehmen (KMU). Anhand von Literaturrecherchen und Fallstudien wird gezeigt, dass KMU besonders anfällig für Cyberangri e sind, da ihnen oft die Ressourcen und das Know-how für umfassende Sicherheitsmaßnahmen fehlen. Die Arbeit analysiert typische Bedrohungen und stellt praxisnahe Maßnahmen zur Verbesserung der IT- Sicherheit vor, darunter Schulungen, technische Schutzmaßnahmen und organisatorische Strategien. Abschließend werden Handlungsempfehlungen für KMU gegeben, um ihre Widerstandsfähigkeit gegenüber Cyberangri en zu erhöhen.",5,5c22837b96ae56614ab85ecb36a9808c773cade64238ac294791bb6070cf6401,"[0.2869941432742106, -0.08312411646903729, 0.03637762073526502, 0.03256687589651662, -0.11251246484401953, -0.053745112353804664, 0.01696857852839222, -0.06376448346542772, -0.06773560525349924, -0.08115202228762085, 0.50810583132747, 0.1986099134715765, 0.05134429680252723, -0.2834372231768625, 0.2672198000459133, 0.18016572970354774, -0.27175954968283705, 0.02225820149567138, -0.10714743233308262, 0.2160834861314709, -0.2767237598852696, -0.11405601426668416, -0.15423908323600247, 0.0789221052686037, 0.08272016296080334]"
IT-Sicherheit,Big Data und Datenschutz: Eine rechtliche Analyse,"Diese Bachelorarbeit untersucht die rechtlichen Aspekte von Big Data im Zusammenhang mit Datenschutz. Anhand von Literaturrecherchen und Fallstudien werden die Herausforderungen der Datenverarbeitung und -speicherung großer Datenmengen analysiert. Es wird aufgezeigt, welche gesetzlichen Rahmenbedingungen, wie die DSGVO, eingehalten werden müssen und welche rechtlichen Konsequenzen bei Verstößen drohen. Die Arbeit schließt mit Empfehlungen für Unternehmen, wie sie den Datenschutz in ihren Big-Data-Projekten sicherstellen und gleichzeitig die Potenziale von Big Data nutzen können.",8,01fe1adaf8689986d455eab1b24f69cce8db1da66048e356f1947a2807a0d9f8,"[0.32674224324576684, -0.2451012728404662, -0.2797801443611961, 0.1960677948023184, -0.3647163561039332, -0.3921559863953338, -0.17785036466040421, -0.4355613681621508, 0.17497822168830982, 0.15789603203859004, -0.27232708311432213, 0.03228985736832257, -0.02613851262810229, 0.09828397216918831, -0.00017453646544072013, 0.015028032203837477, -0.1761327425220009, 0.046567064063717356, -0.0035675235570396405, 0.011926377928287588, -0.008989309099318308, -0.05593812522269648, 0.0471140227668974, -0.016317317753119308, -0.0766082765175541]"
IT-Sicherheit,Ethische Herausforderungen in der digitalen Transformation,"Diese Arbeit befasst sich mit den ethischen Herausforderungen der digitalen Transformation. Durch die zunehmende Digitalisierung und den Einsatz von Technologien wie KI, Big Data und IoT entstehen neue ethische Fragestellungen. Anhand von Literaturrecherchen und Fallstudien werden die ethischen Implikationen für Datenschutz, Arbeitsplatzverlust und soziale Gerechtigkeit analysiert. Die Arbeit zeigt, dass eine verantwortungsvolle Nutzung der Technologien entscheidend ist, um negative Auswirkungen zu minimieren. Abschließend werden    ethische Leitlinien und Empfehlungen für Unternehmen und politische Entscheidungsträger entwickelt.",6,20e8e02daa3afd7cb2784f9721a565f33dc2d75ea0bcae4a101b944da02b3c7c,"[0.44314546269249333, -0.2539173031432667, -0.38184654859499195, 0.1966957567598424, 0.11468409859791986, -0.216218387498032, -0.06317703008942877, 0.11732618239333388, 0.0015259681614003136, -0.11034234597030917, -0.07615776381084381, -0.08925053295042344, 0.01490275242198744, -0.1878889885311102, -0.00817241146884143, 0.002357528863473495, 0.09876661961062985, 0.05839080251673445, -0.02626791472559096, 0.05504652134522449, -0.07350692065712314, -0.012450158716211069, -0.07856601742596897, 0.05335552284974453, -0.029276603545086873]"
Umweltwissenschaften,Klimawandel und seine Auswirkungen auf die Landwirtschaft,"Diese Bachelorarbeit untersucht die Auswirkungen des Klimawandels auf die Landwirtschaft. Durch eine Kombination aus Literaturrecherche und empirischen Studien werden die klimatischen Veränderungen und deren Einfluss auf Ernteerträge, Bodenqualität und Wasserverfügbarkeit analysiert. Es wird gezeigt, dass der Klimawandel sowohl Herausforderungen als auch Chancen für die Landwirtschaft mit sich bringt. Anpassungsstrategien wie die Einführung klimafreundlicher Anbaumethoden und die Nutzung resilienter Pflanzensorten werden vorgestellt. Abschließend werden politische und wirtschaftliche Empfehlungen zur Unterstützung der landwirtschaftlichen Anpassung an den Klimawandel gegeben.",0,a888c5a5f7795fd6e0548502062e6aa3fd67407612dd07bfbdcb7cb47e474f26,"[0.42649439795356864, 0.07600659034831518, -0.07686499556285079, -0.12285175261980862, 0.11826056958536997, 0.07059761758437928, 0.1100111004775137, 0.022287875237226216, 0.12205456158070074, 0.23097926636962152, -0.13516087343544955, 0.3457563258094983, 0.12399996769937233, -0.12785484976491032, -0.020445239113688077, 0.23502042340625506, 0.09454211271408164, -0.033080655883070055, 0.22268663614780737, -0.1795551332033583, 0.028795501012042236, -0.16332818453395684, -0.12959482175199113, -0.14840041609776095, -0.049712580673744684]"
Umweltwissenschaften,Erneuerbare Energien: Potenziale und Herausforderungen,"Diese Arbeit beleuchtet die Potenziale und Herausforderungen erneuerbarer Energien. Durch eine umfassende Literaturrecherche werden verschiedene erneuerbare Energiequellen wie Solar-, Wind- und Wasserkraft analysiert. Die Arbeit zeigt, dass erneuerbare Energien erheblich zur Reduktion von Treibhausgasemissionen und zur nachhaltigen Energieversorgung beitragen können. Gleichzeitig werden Herausforderungen wie technologische Entwicklung, Speicherlösungen und politische Rahmenbedingungen diskutiert. Abschließend    werden Strategien und Handlungsempfehlungen zur Förderung und Integration erneuerbarer Energien gegeben.",10,765606f9ce06a0a60d5c07bd0d7133360290af276fbe8d4fa0a2579fb0c0d7a8,"[0.330754291545207, -0.2639913322445301, 0.28047420432981424, 0.20260628951954443, -0.19354651096564837, -0.24319232284218592, 0.6891994297508494, 0.14871850805848225, 0.009412482479442957, 0.01175717305828153, 0.09249852134449318, 0.005910200887434608, -0.03371190529706091, 0.0776234298616971, -0.16360658364372632, 0.04544687538471683, -0.05820671815103573, 0.07623558858377834, 0.10956939461734747, 0.024705710305517922, 0.09229830459167504, 0.010863522369919167, 0.018378232015238607, 0.029536355515945637, -0.08635818443556331]"
Umweltwissenschaften,Mikroplastik in den Ozeanen: Ursachen und Lösungen,"Diese Bachelorarbeit untersucht die Ursachen und Lösungen für die Verschmutzung der Ozeane durch Mikroplastik. Durch eine Kombination aus Literaturrecherche und empirischen Studien werden die Quellen von Mikroplastik und deren Auswirkungen auf marine Ökosysteme und die menschliche Gesundheit analysiert. Es wird aufgezeigt, dass Mikroplastik aus verschiedenen Quellen wie Kosmetika, Textilien und Reifenabrieb stammt und durch Flüsse und Abwässer in die Ozeane gelangt. Abschließend werden mögliche Lösungsansätze zur Reduktion von Mikroplastik, darunter technologische Innovationen, politische Maßnahmen und Verbraucherverhalten, vorgestellt.",2,67ff2e4749816028f55a53a8992573d1d52f9cae0f6219a7090e1f3cde4b0f48,"[0.2898787536008427, 0.0267936330997349, 0.06424754567380761, -0.034623884364000775, 0.005201681339134326, -0.04242631969299261, 0.04919727399033479, -0.03213563030561393, 0.005275951511938963, 0.022856667457179472, -0.011465209034570854, 0.0473065250715515, 0.04473715679955627, -0.013430765556079168, 0.06218571967294649, 0.02733273914605737, 0.02245635394798821, 0.0035925693760881414, 0.08343087202490726, -0.005728457143134046, -0.03877829900375043, -0.05458061342950385, 0.04033913666757443, 0.07564067871049202, -8.812636863542414e-05]"
Biowissenschaften,Ethische Implikationen von Gen-Editing,"Diese Arbeit untersucht die ethischen Implikationen des Gen-Editings, insbesondere der CRISPR/Cas9-Technologie. Durch eine Kombination aus Literaturrecherche und Fallstudien werden die Anwendungsmöglichkeiten im medizinischen und agrarwissenschaftlichen Bereich analysiert. Es wird diskutiert, welche ethischen Fragen sich durch das gezielte Verändern von Genen ergeben, darunter Fragen zur Sicherheit, Fairness und den langfristigen Folgen für die Umwelt und die Gesellschaft. Abschließend werden ethische Leitlinien und Empfehlungen für den verantwortungsvollen Einsatz von Gen-Editing- Technologien entwickelt.",6,c4df8105210dfe49d80d7e1023933fb75657c990e4cf16cf4c4c55b250b303ab,"[0.36703946509033913, -0.10280704908623192, -0.2331138186832528, 0.07511006808257566, 0.3019794424469528, -0.12542619197236962, -0.02151831626171753, 0.08385886432049702, -0.030557641581796285, -0.1871692816848887, 0.06389964646369058, -0.02699764199342813, -0.063023587649123, 0.0068617665891660675, 0.2628714104593113, 0.16497333997158314, 0.04373169520228419, 0.18911529474551453, 0.1845093774180823, 0.03127847710804814, 0.07917004363670858, 0.395903489153013, 0.30570794179549465, -0.1811230542522757, -0.12648794690179205]"
Biowissenschaften,Einfluss von Musik auf die Lernleistung von Schülern,"Diese Bachelorarbeit untersucht den Einfluss von Musik auf die Lernleistung von Schülern. Durch eine Kombination aus Literaturrecherche und empirischen Studien wird analysiert, wie verschiedene Musikstile und -richtungen das Lernen und die Konzentration von Schülern beeinflussen. Es wird gezeigt, dass Musik sowohl positive als auch negative E ekte haben kann, abhängig von Faktoren wie Lautstärke, Tempo und persönlichen Vorlieben. Die Arbeit schließt mit Empfehlungen für den Einsatz von Musik im schulischen Kontext, um die Lernumgebung zu optimieren und die Leistungsfähigkeit der Schüler zu steigern.",12,9b652090916c3d098f4c298b21273980a27409ce9878e56195689af5e9505ede,"[0.36606257874324366, 0.12409210373561382, -0.12368203448665625, -0.13610836223033315, -0.1254586665731475, -0.06584428793112901, -0.02344184437764717, 0.16509886435442994, -0.02484155056032986, 0.025558774489601387, -0.05766271223050786, -0.057263708592341776, -0.02822310977891987, 0.037778985894845414, -0.03749874073799253, -0.04049505465856054, -0.03198795354214967, 0.04074938544020376, 0.04862651164339995, 0.1330595426502583, -0.07173524774764363, -0.0028069959898816294, -0.018095997514293204, -0.04941308496094499, 0.08634565908370145]"
Biowissenschaften,Psychologische Auswirkungen von Social Media Nutzung,"Diese Arbeit untersucht die psychologischen Auswirkungen der Nutzung von Social Media. Durch eine Kombination aus Literaturrecherche und empirischen Studien werden verschiedene Aspekte wie Selbstwahrnehmung, sozialer Vergleich und psychische Gesundheit analysiert. Es wird gezeigt, dass intensive Social-Media-Nutzung sowohl positive E ekte wie soziale Vernetzung und Informationsaustausch als auch negative E ekte wie Depression, Angst und Suchtverhalten haben kann. Abschließend werden Empfehlungen für eine gesunde und ausgewogene Nutzung von Social Media gegeben, um die psychischen Belastungen zu minimieren.",3,8f54452e0f52e5a182288eb5dfc87fc18b44b395455be37c6c90993261960237,"[0.33290815408694235, 0.36175629346870725, -0.07191924737232946, 0.316729095706877, -0.07853356411583909, 0.03203126667419299, 0.02046527650760328, 0.16918443066217426, -0.042065321148528206, 0.0660897639683286, -0.11686166742726052, 0.005562636810075059, -0.05365794345900282, -0.026859832333003965, 0.10499384267945691, -0.016189324083580002, 0.02799137384606667, -0.049664908117528626, 0.02731424016710996, 0.008672971416528613, -0.04895868145413891, -0.10562812418847342, -0.008009551697450764, 0.009269898046594876, 0.03942529105733148]"
Bildung,E-Learning: E ektivität und Herausforderungen,"Diese Bachelorarbeit untersucht die E ektivität und Herausforderungen des E- Learnings im Vergleich zu traditionellen Lernmethoden. Anhand von Literaturrecherchen und empirischen Studien werden die Vor- und Nachteile des E-Learnings analysiert. Es wird gezeigt, dass E-Learning flexible und ortsunabhängige Lernmöglichkeiten bietet, jedoch auch Herausforderungen wie technische Barrieren und fehlende soziale Interaktion mit sich bringt. Die Arbeit schließt mit Empfehlungen zur Optimierung von E-Learning-Plattformen und - Strategien, um die Lernergebnisse zu verbessern und die Herausforderungen zu überwinden.",9,77f6910cfdbe3ffd15f651285eb22a28cd7c5bcecb0cce658459ae2b20ff2976,"[0.396862982917386, -0.10117707039464167, -0.08722557217370776, -0.014489994024671613, -0.14293070016008175, 0.18159018817534897, 0.019673308907000767, -0.06656179035066556, -0.18324974803960278, 0.12494419590787005, 0.026517717621580623, 0.24508554343340605, -0.12373526123542852, 0.018436181816083634, -0.009978354463827473, -0.18380483371957163, 0.12347850097254703, 0.1648430938888138, 0.0020332967812459707, 0.0693374189512796, -0.08066718282411471, 0.11364637713665471, -0.14503288821720184, 0.039114667993278354, -0.055976555849719487]"
