topic,title,text,cluster,id_hash,vector
Anorganische Chemie,Entwicklung umweltfreundlicher Synthesemethoden,"Diese Bachelorarbeit untersucht die Entwicklung umweltfreundlicher Synthesemethoden in der Chemie. Durch eine Kombination aus Literaturrecherche und Fallstudien werden verschiedene Ansätze zur Reduktion von Abfall, Energieverbrauch und Umweltauswirkungen in chemischen Synthesen analysiert. Es wird gezeigt, dass grüne Chemieprinzipien und nachhaltige Methoden entscheidend zur Schonung der Umwelt und zur Förderung der Ressourcene izienz beitragen. Abschließend werden Empfehlungen für Chemiker und die chemische Industrie gegeben, wie sie umweltfreundliche Synthesemethoden entwickeln und in die Praxis umsetzen können.",1,e998f02cbe91a87934b15ecf3bfda2db6a4a82e1497c938a5b56a5d11d99eb5b,"[0.38759609380596566, -0.11341360905517743, 0.2897769223037893, 0.03718378989194528, 0.06444447572034981, 0.01680142475032553, -0.08371300899194625, 0.003268271010933812, -0.04917087824852617, 0.05027376160234343, -0.024079441001041174, -0.07834318331339123, 0.0796143385336149, 0.0798715342520389, 0.03351866620755892, -0.01723380162254361, -0.0978729716936653, 0.04949997201659643, 0.03294651274054612, -0.002258424701911526, 0.04633427291675255, -0.011078422320757458, 0.04638370596828415, -0.07621473083385179, 0.023615604857501672]"
Organische Chemie,Entwicklung neuer Arzneimittel: Synthese und Testung,"Diese Arbeit untersucht die Entwicklung neuer Arzneimittel von der Synthese bis zur Testung. Durch eine Kombination aus Literaturrecherche und Fallstudien werden verschiedene Ansätze und Methoden in der Arzneimittelforschung analysiert, darunter die Wirksto synthese, präklinische Tests und klinische Studien. Es wird gezeigt, dass die Entwicklung neuer Arzneimittel komplexe und interdisziplinäre Prozesse erfordert. Abschließend werden die Herausforderungen und zukünftigen Perspektiven der Arzneimittelforschung diskutiert und Empfehlungen für die Praxis gegeben.",2,e5711ffb41a7d8e792e6ecade7c991135ef9f667b3e100de615852112c28d365,"[0.3257806938019331, -0.01625122648117048, 0.08522493310678514, -0.037525022963970284, 0.05422135300061468, -0.00225658982297788, 0.0541410506884453, -0.05963331959467572, -0.09022175714703642, 0.001884071380475019, -0.009452967282485918, -0.0016014333262636996, 0.04017887112678329, 0.06442541054773697, 0.03188663333530436, -0.03973357378695655, -0.05583144085275497, -0.05436788100912544, 0.005656175591969074, -0.0006368207418548299, 0.013342347518611653, -0.03435912009658412, 0.03404353066724088, -0.021787177057845143, 0.020654073710141985]"
Organische Chemie,Einfluss von Lösungsmitteln auf organische Reaktionen,"Diese Bachelorarbeit untersucht den Einfluss von Lösungsmitteln auf organische Reaktionen und deren Mechanismen. Durch eine Kombination aus Literaturrecherche und empirischen Studien werden verschiedene Lösungsmittel und deren Wirkung auf Reaktionsgeschwindigkeit, Ausbeute und Selektivität analysiert. Es wird gezeigt, dass die Wahl des Lösungsmittels entscheidend für den Erfolg organischer Synthesen ist. Abschließend werden Empfehlungen für die Auswahl geeigneter Lösungsmittel in der organischen Chemie gegeben, um die E izienz und Nachhaltigkeit der Reaktionen zu verbessern.",2,9aad01f03b60bc64e77651648e39ff32dc03d77d969702317e663f4d891c5b8f,"[0.3372236690426208, 0.09333650161275744, 0.02628239125622374, -0.0838045560064912, 0.03346846485052945, 0.008696172932694216, -0.028211203212389104, -0.016458121827026884, 0.024814975772710045, 0.02067716454705949, 0.019924636100641095, -0.06854020226121686, -0.006680172185776685, 0.022127261926108515, -0.06560099939216818, 0.01979706304413275, -0.04113138671740507, 0.10238356123663274, -0.04245751689717004, -0.09704559944144814, -0.05043296617148479, 0.010230488757974412, -0.008614460912295292, -0.06860055848715639, 0.030908964891058124]"
Organische Chemie,Biokatalyse in der organischen Synthese,"Diese Arbeit untersucht den Einsatz von Biokatalysatoren in der organischen Synthese und deren Vorteile und Herausforderungen. Durch eine Kombination aus Literaturrecherche und Fallstudien werden verschiedene Enzyme und Mikroorganismen analysiert, die als Biokatalysatoren in der Chemie verwendet werden. Es wird gezeigt, dass Biokatalyse umweltfreundliche und e iziente Alternativen zu traditionellen chemischen Katalysatoren bieten kann. Abschließend werden die Potenziale und Herausforderungen der Biokatalyse diskutiert und Empfehlungen für die Forschung und Entwicklung gegeben.",2,72f5cbfabbb5d3691e497a9abc8cc0f559f4fb98a46f3cee80ff260358fac66d,"[0.39755411491217363, -0.051265509008154936, 0.0439358288201344, -0.007843557130137069, 0.04697325651637222, 0.05194411621649452, 0.054055673448976264, -0.06239986468096395, -0.1033253206098701, 0.02987816891803912, 0.01338134377939479, -0.07517288641201646, 0.0446674934771004, 0.03661270667568337, 0.007702065231191722, -0.030697304065739683, -0.11813717118913773, 0.026731189710655693, -0.02289653768729076, -0.02259478893978164, 0.0349117292366729, -0.03478744832010531, 0.07199521310806732, -0.07821931549794174, 0.08692094356074011]"
Klimawissenschaften,Klimawandel und seine Auswirkungen auf die Landwirtschaft,"Diese Bachelorarbeit untersucht die Auswirkungen des Klimawandels auf die Landwirtschaft. Durch eine Kombination aus Literaturrecherche und empirischen Studien werden die klimatischen Veränderungen und deren Einfluss auf Ernteerträge, Bodenqualität und Wasserverfügbarkeit analysiert. Es wird gezeigt, dass der Klimawandel sowohl Herausforderungen als auch Chancen für die Landwirtschaft mit sich bringt. Anpassungsstrategien wie die Einführung klimafreundlicher Anbaumethoden und die Nutzung resilienter Pflanzensorten werden vorgestellt. Abschließend werden politische und wirtschaftliche Empfehlungen zur Unterstützung der landwirtschaftlichen Anpassung an den Klimawandel gegeben.",0,ed32d9a7e0734cd400528d35c8d749162f0ba756d8e9c6654542422f22d7c9aa,"[0.42649439795356864, 0.07600659034831518, -0.07686499556285079, -0.12285175261980862, 0.11826056958536997, 0.07059761758437928, 0.1100111004775137, 0.022287875237226216, 0.12205456158070074, 0.23097926636962152, -0.13516087343544955, 0.3457563258094983, 0.12399996769937233, -0.12785484976491032, -0.020445239113688077, 0.23502042340625506, 0.09454211271408164, -0.033080655883070055, 0.22268663614780737, -0.1795551332033583, 0.028795501012042236, -0.16332818453395684, -0.12959482175199113, -0.14840041609776095, -0.049712580673744684]"
Klimawissenschaften,Einfluss von Klimawandel auf die Meeresökosysteme,"Diese Arbeit untersucht den Einfluss des Klimawandels auf die Meeresökosysteme und deren Biodiversität. Durch eine Kombination aus Literaturrecherche und empirischen Studien werden verschiedene Aspekte des Klimawandels, darunter die Erwärmung der Ozeane, der Anstieg des Meeresspiegels und die Versauerung der Meere, analysiert. Es wird gezeigt, dass der Klimawandel erhebliche negative E ekte auf die marinen Ökosysteme und die darin lebenden Arten haben kann. Abschließend werden Maßnahmen zur Anpassung und zum Schutz der Meeresökosysteme in Zeiten des Klimawandels diskutiert und Empfehlungen für den Naturschutz gegeben.",0,2612f24263a18eed9926bbaf0902b7722360997d89c9489a54ddbdde46a3d3f2,"[0.38270985971419336, 0.11884991647524251, 0.005489233248999821, -0.15335296706179724, 0.12024377246215555, 0.00723537376011636, 0.08980205220841035, -0.03853846925829243, 0.11427126412631232, 0.12755571989359638, -0.05890833592334153, 0.13931866783932217, 0.03225668969703292, -0.019781100611947277, 0.060369476654748275, 0.12920279461371598, 0.0038074387048276496, 0.07681017600922986, 0.055359483674567084, 0.012103022542769369, -0.02765023404451268, -0.1437806667952908, -0.07139587299864673, -0.02105551175343341, -0.055628983259142825]"
Klimawissenschaften,Klimaschutzmaßnahmen: Internationale Perspektiven und Herausforderungen,"Diese Bachelorarbeit untersucht internationale Perspektiven und Herausforderungen von Klimaschutzmaßnahmen. Durch eine Kombination aus Literaturrecherche und Fallstudien werden verschiedene internationale Klimaschutzinitiativen und -abkommen analysiert, darunter das Pariser Abkommen und die Klimapolitik der Europäischen Union. Es wird gezeigt, dass internationale Zusammenarbeit und ambitionierte Klimaschutzmaßnahmen entscheidend für die Bewältigung des Klimawandels sind, jedoch auch Herausforderungen wie politische Widerstände und wirtschaftliche Interessen bestehen. Abschließend werden Empfehlungen für die Verbesserung der internationalen Klimapolitik und die Förderung globaler Klimaschutzmaßnahmen gegeben.",2,c961a7efe4bedb831636202b5a663a3f342e07b0949f83a5b7a7b208e5c4e548,"[0.30411140612500187, -0.01312198002921335, 0.04477381159039371, -0.020977387570482908, 0.040828545079348084, 0.04829565350819685, 0.03626594622262542, -0.07614686427223105, -0.009480923881919357, -0.031531860406248675, 0.006679914249333527, 0.08491248973678145, -0.0252297405979296, -0.04744294966954199, 0.006643690174109029, 0.08174125666914421, -0.008676435608007111, -0.03698151145136969, 0.001948741854310209, -0.07789043661845511, 0.005759458408445195, -0.06020316093669838, -0.017855207444194592, -0.07110321312112107, -0.03321367593701414]"
Abfallwirtschaft,Kreislaufwirtschaft: Konzepte und Praxisbeispiele,"Diese Arbeit untersucht die Konzepte und Praxisbeispiele der Kreislaufwirtschaft und deren Beitrag zur Ressourcenschonung und Abfallreduktion. Durch eine Kombination aus Literaturrecherche und Fallstudien werden verschiedene Ansätze der Kreislaufwirtschaft analysiert, darunter Recycling, Wiederverwendung und industrielle Symbiose. Es wird gezeigt, dass die Kreislaufwirtschaft erhebliche Potenziale zur Reduktion von Abfall und zur Förderung nachhaltiger Produktions- und Konsummuster bietet. Abschließend werden Empfehlungen für Unternehmen und politische Entscheidungsträger gegeben, wie sie die Kreislaufwirtschaft fördern und umsetzen können.",1,2a327c9e93b6e26784994b100d2c1b1c62f0b0856302b8b60c9475a7e371d0b3,"[0.4053499635733545, -0.12933142391842337, 0.3069634528950422, 0.0589450446861799, 0.06235433041701835, -0.027414127264138322, -0.08066553445459126, 0.043907962331183506, 0.0647750660107485, 0.005172669726023624, -0.09295713738808778, 0.12371687335162913, 0.061378190258271924, -0.03005480864558646, -0.02941925132714561, 0.030824843676774117, 0.03051450058278743, -0.07592257241367786, -0.03315985066541521, -0.09915842758312969, -0.055052420871014786, 0.043487785108821224, 0.3390458704341172, 0.372852300940249, 0.1322537714821507]"
Abfallwirtschaft,Abfallmanagement in städtischen Gebieten: Herausforderungen und Lösungen,"Diese Bachelorarbeit untersucht die Herausforderungen und    Lösungen des Abfallmanagements in städtischen Gebieten. Durch eine Kombination aus Literaturrecherche und Fallstudien werden verschiedene Abfallmanagementsysteme und - strategien analysiert, die zur Reduktion und e izienten Entsorgung von städtischem Abfall beitragen. Es wird gezeigt, dass eine ganzheitliche und integrierte Herangehensweise entscheidend für den Erfolg des städtischen Abfallmanagements ist. Abschließend werden Empfehlungen für städtische Verwaltungen und politische Entscheidungsträger gegeben, wie sie e ektive und nachhaltige Abfallmanagementstrategien entwickeln und umsetzen können.",1,ad18c6dc1d90245b5b9fcfd8b2eb5a778e0af4036444390cda90c9eeef42cee2,"[0.40054659140336135, -0.10515228347915116, 0.27626996565819517, 0.04233478531942831, 0.03870184672248134, 0.00530528121460329, -0.11957223337825196, 0.07176520275710681, 0.1383224379598015, -0.12831234043181156, -0.09806888340554014, 0.06052362758598249, -0.02959999707548675, -0.0008233119034441307, -0.1615383244478884, 0.029466550347102726, 0.0050839249272645595, 0.22357688914834478, -0.0021254083746430038, -0.016948695890201346, -0.23616974911621455, 0.047743091635524475, 0.018817772564791703, -0.1260956089765228, -0.058870503810064076]"
Abfallwirtschaft,Einfluss von Plastikabfall auf die Umwelt und Maßnahmen zur Reduktion,"Diese Arbeit untersucht den Einfluss von Plastikabfall auf die Umwelt und verschiedene Maßnahmen zur Reduktion von Plastikabfällen. Durch eine Kombination aus Literaturrecherche und empirischen Studien werden die Umweltbelastungen durch Plastikabfall analysiert, darunter die Verschmutzung von Ozeanen und die gesundheitlichen Risiken für Tiere und Menschen. Es werden verschiedene Strategien und Maßnahmen zur Reduktion von Plastikabfällen vorgestellt, darunter Recycling, Plastikverbote und nachhaltige Verpackungsalternativen. Abschließend werden Empfehlungen für politische Entscheidungsträger und Unternehmen gegeben, wie sie die Plastikabfälle reduzieren und die Umweltbelastung minimieren können.",1,0fee5a94b8b2ecb3a4136a96df1d17efec698af1387458185f4b6d009dfbea78,"[0.41273794492442595, 0.0025171291081901234, 0.14822481583970856, -0.004613096251848667, -0.011896597687311137, -0.07719081631390676, -0.030117873646058668, 0.06480031766082218, 0.027819117298506956, 0.025568591305601997, -0.01533071668090138, 0.04008742716254358, 0.027777688840784173, -0.02755138721071047, 0.09186932955707161, 0.04597280963722272, 0.03728832228689567, 0.008656049661405173, 0.07351291276258248, 0.016715868414616374, -0.03112534399378122, -0.021966975480749412, 0.08148565266388724, 0.09086857517754691, -0.03964799497466216]"
Angewandte Mathematik,Mathematische Modelle in der Epidemiologie: Anwendungen und Herausforderungen,"Diese Bachelorarbeit untersucht die Anwendungen und Herausforderungen mathematischer Modelle in der Epidemiologie. Durch eine Kombination aus Literaturrecherche und Fallstudien werden verschiedene mathematische Modelle analysiert, die zur Vorhersage und Kontrolle von Krankheitsausbrüchen eingesetzt werden. Es wird gezeigt, dass mathematische Modelle entscheidende Werkzeuge für die Epidemiologie sind, jedoch auch Herausforderungen wie Datenverfügbarkeit und Modellgenauigkeit mit sich bringen. Abschließend werden Empfehlungen für die Entwicklung und Anwendung mathematischer Modelle in der Epidemiologie gegeben.",9,bacd84de7a1049acdd6c332108b79e4051b537191a5001a36241d8dbded4dc99,"[0.29108020074982227, -0.06553327106253043, 0.013326748546279311, -0.009973642343182262, 0.013234130915550901, 0.08978039412291955, 0.046855088073780186, -0.0882948335697882, -0.13774323727709464, 0.04930612838617541, 0.030737347747005133, -0.005436379837679106, 0.0299727319929762, 0.013752897538764798, -0.04395614139726014, -0.011214571655514614, -0.0644109719728398, -0.04052443542435247, -0.021191801517803064, -0.024522632665927482, 0.02885285907920554, -0.07020360774722442, 0.073195973801664, -0.04048336462505982, 0.037714537247750514]"
Angewandte Mathematik,Optimierungsprobleme in der Logistik: Mathematische Ansätze und Lösungen,"Diese Arbeit untersucht Optimierungsprobleme in der Logistik und verschiedene mathematische Ansätze zur Lösung dieser Probleme. Durch eine Kombination aus Literaturrecherche und Fallstudien werden verschiedene Optimierungstechniken analysiert, darunter lineare Programmierung, Netzwerkoptimierung und heuristische Methoden. Es wird gezeigt, dass mathematische Optimierung entscheidende Vorteile für die E izienz und Kostenreduktion in der Logistik bietet. Abschließend werden Empfehlungen für die Anwendung mathematischer Optimierungsansätze in der Logistik gegeben, um deren Potenziale optimal zu nutzen.",9,fad7dea87f07bccefcb262b548782c8e5d1274bf5b01a286bd4c3dbcaf104371,"[0.28641661254171924, -0.05690756859311667, 0.06419397426265122, -0.011613986474311003, 0.03671138443895648, 0.12423610891750744, 0.005942401582074105, -0.10226461157587255, -0.0771201396454455, 0.06532515517357758, 0.05156144104075868, -0.09064937226851098, -0.013122913497032086, 0.04021139354936716, 0.031428421418508976, -0.021429979579915104, -0.13362372188944074, -0.016416898139987018, -0.06716258760991198, -0.04456036258732192, 0.09023184830490023, -0.063357621211948, 0.08815910243086812, -0.03149229365968109, 0.04900898446874965]"
Angewandte Mathematik,Finanzmathematik: Modelle und Anwendungen,"Diese Bachelorarbeit untersucht die Modelle und Anwendungen der Finanzmathematik. Durch eine Kombination aus Literaturrecherche und Fallstudien werden verschiedene mathematische Modelle analysiert, die zur Bewertung von Finanzinstrumenten und zur Risikobewertung eingesetzt werden. Es wird gezeigt, dass die Finanzmathematik entscheidende Werkzeuge für die Finanzwirtschaft und das Risikomanagement bietet. Abschließend werden die Herausforderungen und zukünftigen Perspektiven der Finanzmathematik diskutiert und Empfehlungen für die Forschung und Praxis gegeben.",2,da8de3af980d07153bd06252474b0126cad8b7f6fda598f4104761047dff01ab,"[0.3697102046317637, -0.02596013809387014, 0.07462363611105527, -0.03652856504218258, 0.050264373830600874, 0.024386368100570086, 0.05141520009096948, -0.10607634993959027, -0.10612743093209513, 0.01942980773744601, 0.048045965570767464, 0.019623846568651727, 0.0016678747028251496, 0.0452818212332047, -0.020422533659947895, -0.0003638381261505795, -0.01921598881749603, -0.038961089827930374, -0.002120289039283586, -0.03966342891846322, 0.01856968074214521, -0.047229326612662756, 0.08474636676508096, 0.010731283074609159, 0.007356507721157951]"
Statistik,Anwendung von statistischen Methoden in der medizinischen Forschung,"Diese Arbeit untersucht die Anwendung statistischer Methoden in der medizinischen Forschung und deren Bedeutung für die Validierung von Forschungsergebnissen. Durch eine Kombination aus Literaturrecherche und Fallstudien werden verschiedene statistische Techniken analysiert, die in der medizinischen Forschung eingesetzt werden, darunter Hypothesentests, Regressionsanalysen und Überlebenszeitanalysen. Es wird gezeigt, dass statistische Methoden entscheidend für die Interpretation und Validierung medizinischer Forschungsergebnisse sind. Abschließend werden Empfehlungen für die Anwendung statistischer Methoden in der medizinischen Forschung gegeben, um die Qualität und Aussagekraft der Studien zu erhöhen.",2,0b7840ef5dbd9fc692d878d547f05a1d1de4689cc173aefd1835bd4e4c994a5a,"[0.30846825634904007, 0.019864753647208248, 0.02439416065337566, -0.064166096344805, 0.03567166027960887, 0.04701601245292654, -0.010454776915067075, -0.09630540909558118, -0.1410798510672712, 0.020613555713878955, 0.056444964974456294, -0.07313020628619353, 0.03975304382605717, 0.02790121404600564, 0.07641170256944425, -0.006067678157220834, -0.10436539880341261, 0.012606135919965657, 0.0016913895208089797, -0.008928424543895915, 0.04217559841430545, 0.011738782653415077, 0.0785779566075955, -0.12436534225825602, -0.03745786315821264]"
Statistik,Einfluss von Datenqualität auf statistische Analysen,"Diese Bachelorarbeit untersucht den Einfluss der Datenqualität auf statistische Analysen und die Ergebnisse von Forschungsstudien. Durch eine Kombination aus Literaturrecherche und empirischen Studien werden verschiedene Aspekte der Datenqualität analysiert, darunter Genauigkeit, Vollständigkeit und Konsistenz. Es wird gezeigt, dass die Datenqualität entscheidend für die Zuverlässigkeit und Validität statistischer Analysen ist. Abschließend werden Empfehlungen für die Sicherstellung und Verbesserung der Datenqualität in Forschungsprojekten gegeben, um die Aussagekraft und Verlässlichkeit der Ergebnisse zu erhöhen.",2,c587925fa33533541a48701478bde8a7b95d0943ecb771b0417ed06a966e08c4,"[0.3258706272691548, 0.06543146299834762, 0.0013191418216566798, -0.06665145870726055, 0.0486547065849826, -0.014294664991672396, -0.003701071222869668, -0.07181750548383911, -0.02831083024975628, -0.007576737657378856, 0.04578003662765091, -0.018490116653340435, -0.002324604756756605, -0.002839669450643605, -0.00227463921642692, 0.0028966908192034554, -0.030615731005776147, -0.001170661857639765, -0.0245501767054845, -0.07601794636985541, -0.051524025627124395, -0.02466293347716866, 0.014693751769293105, -0.028318219324124923, -0.02352311561673434]"
Statistik,Anwendung von maschinellem Lernen in der Statistik,"Diese Arbeit untersucht die Anwendung von maschinellem Lernen in der Statistik und deren Potenziale und Herausforderungen. Durch eine Kombination aus Literaturrecherche und Fallstudien werden verschiedene maschinelle Lerntechniken analysiert, die in der statistischen Datenanalyse eingesetzt werden, darunter Clusteranalyse, Klassifikation und Regression. Es wird gezeigt, dass maschinelles Lernen neue Möglichkeiten für die Analyse großer und komplexer Datenmengen bietet, jedoch auch Herausforderungen wie die Interpretierbarkeit der Modelle mit sich bringt. Abschließend werden Empfehlungen für die Integration von maschinellem Lernen in die statistische Praxis gegeben.",9,dc1cd38641da95a6dd4d284a8d17e09a916ca226d9be93e28e161a8fefc05e4a,"[0.37643056515775714, -0.06713010647662308, -0.03004438581473687, -0.03130465452859964, -0.025344725344764688, 0.08351676942451372, 0.04166222073225301, -0.11160888955176389, -0.16329319509948648, 0.034904771990094244, -0.06923843818657212, 0.012236721643033379, 0.06454529987899736, 0.02077972521921814, -0.07923706044335105, 0.014266095606165659, -0.07405111889417455, -0.0658066986690281, -0.08750433926551268, 0.0656946493607153, 0.032275085612080354, -0.03534737604994588, 0.11046190755120634, -0.09685002396811908, -0.022914180533791764]"
Schulbildung,Einfluss von digitalem Lernen auf die schulische Leistung,"Diese Bachelorarbeit untersucht den Einfluss von digitalem Lernen auf die schulische Leistung von Schülern. Durch eine Kombination aus Literaturrecherche und empirischen Studien wird gezeigt, dass digitales Lernen sowohl positive als auch negative E ekte auf die schulische Leistung haben kann, abhängig von Faktoren wie der Qualität der digitalen Inhalte, der technischen Ausstattung und der pädagogischen Unterstützung. Es werden verschiedene digitale Lernplattformen und -methoden analysiert, die sich besonders    positiv auf die schulische Leistung auswirken. Abschließend werden Empfehlungen für die Gestaltung und Implementierung von digitalen Lernangeboten im Schulwesen gegeben.",0,61cb110083a5d3d90e642fe02cae2756753e681ded46e2687136d9cb354a1c4c,"[0.3613755900655649, 0.15280615527471847, -0.12400687687195436, -0.2236748841000285, -0.10935553261957154, 0.034389586512292805, 0.003933116927498803, 0.1833627755614002, -0.08054059211713714, 0.05055731936341389, -0.16094237511830256, -0.053198456211799625, -0.017115263972922304, 0.025969207999344095, -0.07012003661556591, 0.07414208343597298, -0.12625448901266545, -0.028649312579838864, 0.05765695054287087, 0.22801017544288749, -0.008116810585659424, -0.03896913952933116, -0.003270935648285841, -0.07252799528356452, -0.05987693143210332]"
Schulbildung,Bedeutung von inklusivem Unterricht für die schulische Integration,"Diese Arbeit untersucht die Bedeutung von inklusivem Unterricht für die schulische Integration von Schülern mit und ohne Behinderungen. Durch eine Kombination aus Literaturrecherche und empirischen Studien wird gezeigt, dass inklusiver Unterricht positive E ekte auf die soziale, emotionale und akademische Entwicklung von Schülern haben kann. Es werden verschiedene Ansätze und Methoden des inklusiven Unterrichts analysiert, die sich als besonders wirksam erwiesen haben. Abschließend werden Empfehlungen für die Implementierung inklusiver Unterrichtskonzepte gegeben, um die schulische Integration und Chancengleichheit zu fördern.",0,53e1ebb85cb204c8711f26344299bb159e7217f924d2058767dd7fc135df632d,"[0.3855371141362942, 0.12889608583968223, -0.04127438354617684, -0.22847978674446853, -0.15637330124559207, -0.038180083830404714, 0.06169263683461905, 0.21584838482973798, -0.09797075438856463, 0.010524147795471683, -0.16522808592296526, -0.002331294448001872, -0.0880084001740487, 0.05989429578667061, 0.11493168225723885, -0.13027006013737433, -0.1031922020850727, -0.08849024118874275, 0.08353192702371143, 0.2222984547352535, -0.02773771123697221, -0.0915408777794705, 0.06941105368481694, -0.1922507789129351, 0.06558473293008925]"
Schulbildung,Einfluss von Elternbeteiligung auf den schulischen Erfolg,"Diese Bachelorarbeit untersucht den Einfluss von Elternbeteiligung auf den schulischen Erfolg von Schülern. Durch eine Kombination aus Literaturrecherche und empirischen Studien wird gezeigt, dass eine aktive Beteiligung der Eltern am schulischen Leben ihrer Kinder positive E ekte auf deren Motivation, Verhalten und Leistungen haben kann. Es werden verschiedene Formen der Elternbeteiligung analysiert, die sich besonders positiv auf den schulischen Erfolg auswirken. Abschließend werden Empfehlungen für Schulen und Eltern gegeben, wie sie die Elternbeteiligung fördern und dadurch den schulischen Erfolg der Schüler unterstützen können.",12,50e1fddabb2bf9bab4ed0db6f6aa03f0734607160adef6b6d65124d0015c2975,"[0.28828821360068935, 0.19089830665808397, -0.044305945411187535, -0.217662798936707, -0.09614170653616852, -0.08459472229252658, -0.08276200451741492, 0.2228521312448263, 0.03689885687065082, -0.029257774561793747, -0.09848672871564985, -0.13853161612291412, 0.03727820247685477, 0.07818114309105839, -0.2715575921095168, 0.15145135152774808, -0.2820815576771531, 0.38609942071759124, -0.00719267375842454, -0.014781482748332487, -0.08514141318762239, 0.13709063450554596, -0.13671948438864237, 0.1944506946364959, 0.3006383171101068]"
